{"acceptance_gates":{"checks":{"april_2026_minimum_trades":true,"april_2026_positive_net_r":true,"august_2025_minimum_trades":true,"august_2025_positive_net_r":true,"december_2025_minimum_trades":true,"december_2025_positive_net_r":true,"february_2026_minimum_trades":true,"february_2026_positive_net_r":true,"january_2026_minimum_trades":true,"january_2026_positive_net_r":true,"july_2026_minimum_trades":true,"july_2026_positive_net_r":true,"june_2026_minimum_trades":false,"june_2026_positive_net_r":true,"march_2026_minimum_trades":true,"march_2026_positive_net_r":true,"maximum_ambiguous_exits":false,"maximum_overall_drawdown_r":false,"maximum_pair_trade_share":true,"maximum_single_fold_profit_share":false,"may_2026_minimum_trades":true,"may_2026_positive_net_r":true,"minimum_bootstrap_mean_fold_net_r_lower":false,"minimum_bootstrap_probability_mean_positive":false,"minimum_distinct_pairs":true,"minimum_overall_profit_factor":false,"minimum_profitable_fold_ratio":false,"minimum_total_trades":true,"minimum_worst_rolling_three_fold_net_r":false,"neighbourhood_robustness":false,"november_2025_minimum_trades":true,"november_2025_positive_net_r":true,"october_2025_minimum_trades":true,"october_2025_positive_net_r":true,"september_2025_minimum_trades":true,"september_2025_positive_net_r":true},"passed":false},"behavior_sha256":"b0f0569e77ab659905018f3948779c52e1eeb70c6bf54319118365d9597d044a","candidate":{"description":"Controlled test of ema_length=45, ema_slope_lookback=4 against production defaults.","name":"grid-0568","parameters":{"ema_length":45,"ema_slope_lookback":4},"source_sha256":"167747d82215a681fa393931f00f0defb17f380ee4e09326c3e9f54663642d62"},"category":"trend-filter","commit":"df7720c78f91fa055f1e38e0e40ba32fa6eee8dc","effect":"trade-changed","generated_at_utc":"2026-09-04T21:53:48+00:00","incumbent_after":"production-baseline","incumbent_before":"production-baseline","objective":{"negative_overall_drawdown_r":-27.417238,"overall_profit_factor":0.8985836648315085,"total_net_r":-11.388801,"total_trades":161,"worst_fold_net_r":-7.32537},"outcome_sha256":"3717d8091bc7651a398ccfbf0281616acec9412604df7009504f352a73b85e1b","previous_sha256":"aad50fc462ce41b4533996ae02eb8869489ac8824fcf2eb9358266a87484c88a","production_release_sha":"9ddd1b44aee10467247fda4627bc472ed1ff4132","record_sha256":"53d7832268b828a2c4fdf6461b328648ce92d2feb22358d026b8ffd0ce5d3637","report_sha256":"d4d76e2780b0145773ac79b2a0ea545e1b8e8be4aa3fa74a434a05ee5b0807d0","run_id":"6421232a9fa7dc84","schema_version":3,"score":"worst_fold_net_r=-7.32537;total_net_r=-11.388801;overall_profit_factor=0.89858366;negative_overall_drawdown_r=-27.417238;total_trades=161","status":"discard","validation":{"dataset_directory":"dukascopy_m1_bidask_2025-05_2026-07","diagnostics":{"annualized_fold_sharpe":-0.6316096266877126,"bootstrap":{"block_size":3,"confidence_level":0.9,"mean_fold_net_r_lower":-3.477741329166667,"mean_fold_net_r_upper":1.3897800000000002,"method":"deterministic-circular-moving-block","probability_mean_positive":0.269,"samples":2000},"fold_count":12,"fold_net_r":[2.7035530000000003,-6.3610050000000005,-7.32537,-4.224317,-4.307232,2.706194,-3.2938449999999992,4.667039000000001,-0.3968910000000001,-3.055003,-3.086917,10.584993],"fold_net_r_stdev":5.205214617753224,"largest_profitable_fold_share":0.5122982391787271,"mean_fold_net_r":-0.9490667499999998,"median_fold_net_r":-3.0709600000000004,"multiple_testing":{"bonferroni_adjusted_confidence":0.0,"prior_candidate_trials":46,"promotion_gate":false,"raw_probability_mean_positive":0.269,"selection_bias_risk":"high","trials_including_current":47},"nonnegative_fold_ratio":0.3333333333333333,"one_sided_sign_test_p_value":0.927001953125,"profitable_fold_count":4,"profitable_fold_ratio":0.3333333333333333,"worst_rolling_three_fold_net_r":-17.910692},"neighbourhood_robustness":{"passed":false,"status":"not-run-base-gates-failed"},"profile":"phase1-walk-forward-v1","profile_sha256":"f02bfcf78d0fa2799c68ef4a7129ec5f635ce27ec3fe3a5267a7d0cfa3ed7afb"},"validation_profile_sha256":"f02bfcf78d0fa2799c68ef4a7129ec5f635ce27ec3fe3a5267a7d0cfa3ed7afb"}
{"acceptance_gates":{"checks":{"april_2026_minimum_trades":true,"april_2026_positive_net_r":true,"august_2025_minimum_trades":true,"august_2025_positive_net_r":true,"december_2025_minimum_trades":true,"december_2025_positive_net_r":true,"february_2026_minimum_trades":true,"february_2026_positive_net_r":true,"january_2026_minimum_trades":true,"january_2026_positive_net_r":true,"july_2026_minimum_trades":true,"july_2026_positive_net_r":true,"june_2026_minimum_trades":false,"june_2026_positive_net_r":true,"march_2026_minimum_trades":true,"march_2026_positive_net_r":true,"maximum_ambiguous_exits":false,"maximum_overall_drawdown_r":false,"maximum_pair_trade_share":true,"maximum_single_fold_profit_share":false,"may_2026_minimum_trades":true,"may_2026_positive_net_r":true,"minimum_bootstrap_mean_fold_net_r_lower":false,"minimum_bootstrap_probability_mean_positive":false,"minimum_distinct_pairs":true,"minimum_overall_profit_factor":false,"minimum_profitable_fold_ratio":false,"minimum_total_trades":true,"minimum_worst_rolling_three_fold_net_r":false,"neighbourhood_robustness":false,"november_2025_minimum_trades":true,"november_2025_positive_net_r":true,"october_2025_minimum_trades":true,"october_2025_positive_net_r":true,"september_2025_minimum_trades":true,"september_2025_positive_net_r":true},"passed":false},"behavior_sha256":"62491fd892f85118d01cf5da9a12f4b485d505bd767935a2c2850c7f966e64ff","candidate":{"description":"Controlled test of ema_slope_lookback=4, tolerance_ticks=1.0 against production defaults.","name":"grid-0653","parameters":{"ema_slope_lookback":4,"tolerance_ticks":1.0},"source_sha256":"3d7bf43428a4f068f2c76680a989ef33b46e65875cfc98fd8ce9769b66b72119"},"category":"trend-filter+wick-detection","commit":"df7720c78f91fa055f1e38e0e40ba32fa6eee8dc","effect":"trade-changed","generated_at_utc":"2026-09-04T21:54:29+00:00","incumbent_after":"production-baseline","incumbent_before":"production-baseline","objective":{"negative_overall_drawdown_r":-22.194964000000006,"overall_profit_factor":0.9184729564043755,"total_net_r":-7.90444,"total_trades":140,"worst_fold_net_r":-6.308206},"outcome_sha256":"3d8a5ef0e5aabfa1014b715842c689053da6bb4fdfe64f6cd1572ebd48200b39","previous_sha256":"53d7832268b828a2c4fdf6461b328648ce92d2feb22358d026b8ffd0ce5d3637","production_release_sha":"9ddd1b44aee10467247fda4627bc472ed1ff4132","record_sha256":"19b15605326a213beb30a1035e541d7ac03b3da2403262fafabea370bed7a83b","report_sha256":"931b21953ee5b6b1fc59a6932c23c6be8f3b5a7d693119aa5f1479f77afcb207","run_id":"9d5a773496a32ac9","schema_version":3,"score":"worst_fold_net_r=-6.308206;total_net_r=-7.90444;overall_profit_factor=0.91847296;negative_overall_drawdown_r=-22.194964;total_trades=140","status":"discard","validation":{"dataset_directory":"dukascopy_m1_bidask_2025-05_2026-07","diagnostics":{"annualized_fold_sharpe":-0.48843948789708574,"bootstrap":{"block_size":3,"confidence_level":0.9,"mean_fold_net_r_lower":-2.826132966666667,"mean_fold_net_r_upper":1.2779095000000003,"method":"deterministic-circular-moving-block","probability_mean_positive":0.32,"samples":2000},"fold_count":12,"fold_net_r":[0.7356240000000001,-6.308206,-6.253249,-5.166151,0.7675449999999997,0.7259959999999999,-2.2756629999999998,6.709293000000001,-0.3257180000000002,-2.033264,-3.086917,8.60627],"fold_net_r_stdev":4.671643750018428,"largest_profitable_fold_share":0.4905331105731591,"mean_fold_net_r":-0.6587033333333333,"median_fold_net_r":-1.179491,"multiple_testing":{"bonferroni_adjusted_confidence":0.0,"prior_candidate_trials":47,"promotion_gate":false,"raw_probability_mean_positive":0.32,"selection_bias_risk":"high","trials_including_current":48},"nonnegative_fold_ratio":0.4166666666666667,"one_sided_sign_test_p_value":0.80615234375,"profitable_fold_count":5,"profitable_fold_ratio":0.4166666666666667,"worst_rolling_three_fold_net_r":-17.727606},"neighbourhood_robustness":{"passed":false,"status":"not-run-base-gates-failed"},"profile":"phase1-walk-forward-v1","profile_sha256":"f02bfcf78d0fa2799c68ef4a7129ec5f635ce27ec3fe3a5267a7d0cfa3ed7afb"},"validation_profile_sha256":"f02bfcf78d0fa2799c68ef4a7129ec5f635ce27ec3fe3a5267a7d0cfa3ed7afb"}
{"acceptance_gates":{"checks":{"april_2026_minimum_trades":true,"april_2026_positive_net_r":true,"august_2025_minimum_trades":true,"august_2025_positive_net_r":true,"december_2025_minimum_trades":true,"december_2025_positive_net_r":true,"february_2026_minimum_trades":true,"february_2026_positive_net_r":true,"january_2026_minimum_trades":true,"january_2026_positive_net_r":true,"july_2026_minimum_trades":true,"july_2026_positive_net_r":true,"june_2026_minimum_trades":false,"june_2026_positive_net_r":true,"march_2026_minimum_trades":true,"march_2026_positive_net_r":true,"maximum_ambiguous_exits":false,"maximum_overall_drawdown_r":false,"maximum_pair_trade_share":true,"maximum_single_fold_profit_share":false,"may_2026_minimum_trades":true,"may_2026_positive_net_r":true,"minimum_bootstrap_mean_fold_net_r_lower":false,"minimum_bootstrap_probability_mean_positive":false,"minimum_distinct_pairs":true,"minimum_overall_profit_factor":false,"minimum_profitable_fold_ratio":false,"minimum_total_trades":true,"minimum_worst_rolling_three_fold_net_r":false,"neighbourhood_robustness":false,"november_2025_minimum_trades":true,"november_2025_positive_net_r":true,"october_2025_minimum_trades":true,"october_2025_positive_net_r":true,"september_2025_minimum_trades":true,"september_2025_positive_net_r":true},"passed":false},"behavior_sha256":"edede21599ad4c963303bdc5495dc5a98d4300bc423a8969cedc1d34eb66d2db","candidate":{"description":"Controlled test of tolerance_ticks=1.5, maximum_wick_ticks=1.5 against production defaults.","name":"grid-0695","parameters":{"maximum_wick_ticks":1.5,"tolerance_ticks":1.5},"source_sha256":"6f7bb328afca9aed38c4cc530e33ef64f31497ef9c73b6371f04c3f3f56c7357"},"category":"wick-detection","commit":"df7720c78f91fa055f1e38e0e40ba32fa6eee8dc","effect":"trade-changed","generated_at_utc":"2026-09-04T21:55:09+00:00","incumbent_after":"production-baseline","incumbent_before":"production-baseline","objective":{"negative_overall_drawdown_r":-28.413984000000003,"overall_profit_factor":0.8884840635119302,"total_net_r":-10.925624,"total_trades":140,"worst_fold_net_r":-6.308206},"outcome_sha256":"e15807b906589b0eb20bb05ab16b382c6bee63990a0f325bf2027752d0d5c951","previous_sha256":"19b15605326a213beb30a1035e541d7ac03b3da2403262fafabea370bed7a83b","production_release_sha":"9ddd1b44aee10467247fda4627bc472ed1ff4132","record_sha256":"62d1be092ef2bd730256bd1b221fc4ce177db72f5a5b2c170642317781e16ee9","report_sha256":"6a3a27b9a2b2f612f29fd7938c169e2f2ad802db2a4335ddc4ae16d6875bc9b4","run_id":"c22ac3ee3545ff64","schema_version":3,"score":"worst_fold_net_r=-6.308206;total_net_r=-10.925624;overall_profit_factor=0.88848406;negative_overall_drawdown_r=-28.413984;total_trades=140","status":"discard","validation":{"dataset_directory":"dukascopy_m1_bidask_2025-05_2026-07","diagnostics":{"annualized_fold_sharpe":-0.6488167394021302,"bootstrap":{"block_size":3,"confidence_level":0.9,"mean_fold_net_r_lower":-3.385896266666667,"mean_fold_net_r_upper":1.4782173958333331,"method":"deterministic-circular-moving-block","probability_mean_positive":0.289,"samples":2000},"fold_count":12,"fold_net_r":[1.7517530000000001,-6.308206,-6.253249,-6.185382000000001,-3.249461,-1.257055,-2.2756629999999998,6.709293000000001,1.6403839999999998,-1.017391,-3.086917,8.60627],"fold_net_r_stdev":4.861089098346347,"largest_profitable_fold_share":0.46003891445768313,"mean_fold_net_r":-0.9104686666666667,"median_fold_net_r":-1.766359,"multiple_testing":{"bonferroni_adjusted_confidence":0.0,"prior_candidate_trials":48,"promotion_gate":false,"raw_probability_mean_positive":0.289,"selection_bias_risk":"high","trials_including_current":49},"nonnegative_fold_ratio":0.3333333333333333,"one_sided_sign_test_p_value":0.927001953125,"profitable_fold_count":4,"profitable_fold_ratio":0.3333333333333333,"worst_rolling_three_fold_net_r":-18.746837},"neighbourhood_robustness":{"passed":false,"status":"not-run-base-gates-failed"},"profile":"phase1-walk-forward-v1","profile_sha256":"f02bfcf78d0fa2799c68ef4a7129ec5f635ce27ec3fe3a5267a7d0cfa3ed7afb"},"validation_profile_sha256":"f02bfcf78d0fa2799c68ef4a7129ec5f635ce27ec3fe3a5267a7d0cfa3ed7afb"}
