{"acceptance_gates":{"checks":{"july_2026_minimum_trades":false,"july_2026_positive_net_r":true,"june_2026_minimum_trades":false,"june_2026_positive_net_r":true,"maximum_ambiguous_exits":true,"maximum_overall_drawdown_r":true,"maximum_pair_trade_share":false,"minimum_distinct_pairs":false,"minimum_overall_profit_factor":true,"minimum_total_trades":false},"passed":false},"behavior_sha256":"17592d71f12da46de60690d29baeea235eb928ef0d7a11db3215f84a61c458e2","candidate":{"description":"Controlled test of entry_model=zone_reclaim, expiry_bars=4, origin_zone_atr_fraction=0.12, reclaim_buffer_ticks=1, maximum_entry_displacement_atr=0.3 against production defaults.","name":"grid-0704","parameters":{"entry_model":"zone_reclaim","expiry_bars":4,"maximum_entry_displacement_atr":0.3,"origin_zone_atr_fraction":0.12,"reclaim_buffer_ticks":1},"source_sha256":"d6ff1211b5de473a18ee4af2ce467a0980d45a2631edf15a69f18d99a97a6588"},"category":"entry-model","commit":"4bcb8fe10e3ef4602f3ae83ab669d8c13ed46f7f","effect":"trade-changed","generated_at_utc":"2026-08-05T13:46:22+00:00","incumbent_after":"production-baseline","incumbent_before":"production-baseline","objective":{"negative_overall_drawdown_r":-1.027778,"overall_profit_factor":1.9264860699489577,"total_net_r":0.9522219999999999,"total_trades":2,"worst_fold_net_r":-1.027778},"outcome_sha256":"ee0d4aa7b3739a1e801f33ff21d457cdcff49fd9b8fb25974e4a1b8a5f21d58f","previous_sha256":"f5a004d85c12a3cece80763640a0bf26ee36576c2098f008ce74ae991c937749","production_release_sha":"9ddd1b44aee10467247fda4627bc472ed1ff4132","record_sha256":"6c27059615b654ad9a2e6eaa383794140b831ea8ad9f50b75a3d2b6500fd3cf4","report_sha256":"cb4725dd6198dbae330c0c80e549639f4ee7194d658b45596996aaa02bdfb3ac","run_id":"fc20c3c254b975be","schema_version":2,"score":"worst_fold_net_r=-1.027778;total_net_r=0.952222;overall_profit_factor=1.9264861;negative_overall_drawdown_r=-1.027778;total_trades=2","status":"discard"}
{"acceptance_gates":{"checks":{"july_2026_minimum_trades":true,"july_2026_positive_net_r":true,"june_2026_minimum_trades":false,"june_2026_positive_net_r":true,"maximum_ambiguous_exits":true,"maximum_overall_drawdown_r":false,"maximum_pair_trade_share":true,"minimum_distinct_pairs":true,"minimum_overall_profit_factor":true,"minimum_total_trades":true},"passed":false},"behavior_sha256":"ed1739457e5f8ae59ce3ab57c2bf842869934972ea3b1e294ed92f7bbe91741d","candidate":{"description":"Controlled test of ema_length=55 against production defaults.","name":"grid-0022","parameters":{"ema_length":55},"source_sha256":"5effa63f67c8aab58c89349181bb8c4fe6a5a5a82dd000d728ced39e4c6a6ecc"},"category":"trend-filter","commit":"05d8bcf419fa06ab96282eb6b15001cf36f5c5a0","effect":"funnel-only","generated_at_utc":"2026-08-05T13:46:27+00:00","incumbent_after":"production-baseline","incumbent_before":"production-baseline","objective":{"negative_overall_drawdown_r":-5.222238,"overall_profit_factor":1.7292928119866589,"total_net_r":7.498075999999999,"total_trades":19,"worst_fold_net_r":-3.086917},"outcome_sha256":"432f57860ab9960cccdcd8fc248f58a2e221a653ea1b93da36727356f0d5ec5a","previous_sha256":"6c27059615b654ad9a2e6eaa383794140b831ea8ad9f50b75a3d2b6500fd3cf4","production_release_sha":"9ddd1b44aee10467247fda4627bc472ed1ff4132","record_sha256":"82e08f9f16040322b4d6c1ca66d9aa7131c3f5bc390aa6644177f6a448338329","report_sha256":"fbd4323dc055d381b29af52cd5320fb91e5b1134bb08d227aae13f0e889a0dc4","run_id":"4073d6b1c2c0635d","schema_version":2,"score":"worst_fold_net_r=-3.086917;total_net_r=7.498076;overall_profit_factor=1.7292928;negative_overall_drawdown_r=-5.222238;total_trades=19","status":"discard"}
{"acceptance_gates":{"checks":{"july_2026_minimum_trades":true,"july_2026_positive_net_r":true,"june_2026_minimum_trades":false,"june_2026_positive_net_r":true,"maximum_ambiguous_exits":true,"maximum_overall_drawdown_r":false,"maximum_pair_trade_share":true,"minimum_distinct_pairs":true,"minimum_overall_profit_factor":true,"minimum_total_trades":true},"passed":false},"behavior_sha256":"2bcec4415a803608646a31c5bd0f69d9b3e217646e9972007bed37670ae48435","candidate":{"description":"Controlled test of ema_length=45, tolerance_ticks=1.0 against production defaults.","name":"grid-0611","parameters":{"ema_length":45,"tolerance_ticks":1.0},"source_sha256":"14762a7bf1b782de026795778e6b1d8959d885e49ac62cf172ce59af7be4d204"},"category":"trend-filter+wick-detection","commit":"b51eebcf0941e015adbf0b6a035eab0f73931707","effect":"trade-changed","generated_at_utc":"2026-08-05T13:46:32+00:00","incumbent_after":"production-baseline","incumbent_before":"production-baseline","objective":{"negative_overall_drawdown_r":-5.222238,"overall_profit_factor":1.5368343118577354,"total_net_r":5.519353,"total_trades":18,"worst_fold_net_r":-3.086917},"outcome_sha256":"45c9470ee2a1914c3a7fa278a57e66a3c3b68160afb9ee15cd75897a8f4ddc65","previous_sha256":"82e08f9f16040322b4d6c1ca66d9aa7131c3f5bc390aa6644177f6a448338329","production_release_sha":"9ddd1b44aee10467247fda4627bc472ed1ff4132","record_sha256":"05156821aa7507ea0eb594aee8a1beaba3ddc9987df929c9b6321a774c344077","report_sha256":"226e7755a7109f251021029ca5dc10f81dd61a2a24c421ac7e8b8a2a44e4becc","run_id":"ebeac0a5edc71d61","schema_version":2,"score":"worst_fold_net_r=-3.086917;total_net_r=5.519353;overall_profit_factor=1.5368343;negative_overall_drawdown_r=-5.222238;total_trades=18","status":"discard"}
{"acceptance_gates":{"checks":{"july_2026_minimum_trades":true,"july_2026_positive_net_r":true,"june_2026_minimum_trades":false,"june_2026_positive_net_r":true,"maximum_ambiguous_exits":true,"maximum_overall_drawdown_r":false,"maximum_pair_trade_share":true,"minimum_distinct_pairs":true,"minimum_overall_profit_factor":true,"minimum_total_trades":true},"passed":false},"behavior_sha256":"e44bb12bd64160dbc13642eb22dc155398c88591859df1b8d588fd285ac7c683","candidate":{"description":"Controlled test of tolerance_ticks=1.0 against production defaults.","name":"grid-0035","parameters":{"tolerance_ticks":1.0},"source_sha256":"9f729410abc9fa7702519ee77a5d9ca7efde8817f9cb1c1c0838ce7930fd5953"},"category":"wick-detection","commit":"17457a0b0fd6597014db4a0546aa946dd2db11a3","effect":"trade-changed","generated_at_utc":"2026-08-05T13:46:38+00:00","incumbent_after":"production-baseline","incumbent_before":"production-baseline","objective":{"negative_overall_drawdown_r":-5.222238,"overall_profit_factor":1.5368343118577354,"total_net_r":5.519353,"total_trades":18,"worst_fold_net_r":-3.086917},"outcome_sha256":"45c9470ee2a1914c3a7fa278a57e66a3c3b68160afb9ee15cd75897a8f4ddc65","previous_sha256":"05156821aa7507ea0eb594aee8a1beaba3ddc9987df929c9b6321a774c344077","production_release_sha":"9ddd1b44aee10467247fda4627bc472ed1ff4132","record_sha256":"322a80c47a67fa1a9e818b65e73f9fc544c4ee53b0ed56c91bc32f69679c9030","report_sha256":"eb8732eda8b2516cebd3ea0e569831cbdc8995e7442bd8bbdcd57eb1b3cff101","run_id":"3b1c4ff660ec033b","schema_version":2,"score":"worst_fold_net_r=-3.086917;total_net_r=5.519353;overall_profit_factor=1.5368343;negative_overall_drawdown_r=-5.222238;total_trades=18","status":"discard"}
{"acceptance_gates":{"checks":{"july_2026_minimum_trades":false,"july_2026_positive_net_r":true,"june_2026_minimum_trades":false,"june_2026_positive_net_r":true,"maximum_ambiguous_exits":true,"maximum_overall_drawdown_r":true,"maximum_pair_trade_share":false,"minimum_distinct_pairs":false,"minimum_overall_profit_factor":true,"minimum_total_trades":false},"passed":false},"behavior_sha256":"d85d996f1944883cc999c2e4a6032324b8e8b802310db8bbb95a2779a382b19c","candidate":{"description":"Controlled test of entry_model=zone_reclaim, expiry_bars=3, origin_zone_atr_fraction=0.1, reclaim_buffer_ticks=2, invalidate_on_trend_change=False against production defaults.","name":"grid-0706","parameters":{"entry_model":"zone_reclaim","expiry_bars":3,"invalidate_on_trend_change":false,"origin_zone_atr_fraction":0.1,"reclaim_buffer_ticks":2},"source_sha256":"503adc7b71d6c5595c069bd8824380a0a707ec21fbc954162e75dd78dca23b36"},"category":"entry-model","commit":"2f6ba0970c8268fa915b122aa92c7a7a6f4fbcf5","effect":"trade-changed","generated_at_utc":"2026-08-05T13:46:43+00:00","incumbent_after":"production-baseline","incumbent_before":"production-baseline","objective":{"negative_overall_drawdown_r":-0.0,"overall_profit_factor":1000000000000.0,"total_net_r":1.976471,"total_trades":1,"worst_fold_net_r":0},"outcome_sha256":"7cced1bb914e01abc69c80a0f5872e1753841660663e0ceb9a2b6b07eb084ec0","previous_sha256":"322a80c47a67fa1a9e818b65e73f9fc544c4ee53b0ed56c91bc32f69679c9030","production_release_sha":"9ddd1b44aee10467247fda4627bc472ed1ff4132","record_sha256":"c4b6b60cd8aed321a2552c35e0cbf012824d931997cd0fb95b6ab34c33aca151","report_sha256":"f483818fb76c9f65f13faae19bf50db3a1df8dba3c483bca721dba9593532392","run_id":"2e7fbacb65f54a09","schema_version":2,"score":"worst_fold_net_r=0;total_net_r=1.976471;overall_profit_factor=1e+12;negative_overall_drawdown_r=-0;total_trades=1","status":"discard"}
{"acceptance_gates":{"checks":{"july_2026_minimum_trades":true,"july_2026_positive_net_r":true,"june_2026_minimum_trades":false,"june_2026_positive_net_r":true,"maximum_ambiguous_exits":true,"maximum_overall_drawdown_r":false,"maximum_pair_trade_share":true,"minimum_distinct_pairs":true,"minimum_overall_profit_factor":true,"minimum_total_trades":true},"passed":false},"behavior_sha256":"9a097b32369d056e8fe49f8ce483542dead25977969419a1d3c91cad0b168ed1","candidate":{"description":"Controlled test of ema_slope_lookback=6 against production defaults.","name":"grid-0028","parameters":{"ema_slope_lookback":6},"source_sha256":"2e2a6edc2c9826c6b34b77f2a3076f0ce970a4cd808b6ad4bfa02685f460c487"},"category":"trend-filter","commit":"1b8954f960235f5baf70bc36ae73be2939441dfb","effect":"trade-changed","generated_at_utc":"2026-08-05T13:46:48+00:00","incumbent_after":"production-baseline","incumbent_before":"production-baseline","objective":{"negative_overall_drawdown_r":-4.200259999999999,"overall_profit_factor":1.9201598951283567,"total_net_r":8.520054,"total_trades":18,"worst_fold_net_r":-2.064939},"outcome_sha256":"255376f4f5c5b66bc66a72be515c87468b8e65b8ccf919f0fdd531c6c4c8b7fb","previous_sha256":"c4b6b60cd8aed321a2552c35e0cbf012824d931997cd0fb95b6ab34c33aca151","production_release_sha":"9ddd1b44aee10467247fda4627bc472ed1ff4132","record_sha256":"b14fc4800dd1822984e844dc801817d69f0c9ed705d9701e9cf404af5c5c8c12","report_sha256":"7ec2d2c0c28b6ecbe97e92ae9d5579a90fb0aa5e10588d2d9fcf60c34cbb6eb0","run_id":"2cbfe2ae27f79cee","schema_version":2,"score":"worst_fold_net_r=-2.064939;total_net_r=8.520054;overall_profit_factor=1.9201599;negative_overall_drawdown_r=-4.20026;total_trades=18","status":"discard"}
{"acceptance_gates":{"checks":{"july_2026_minimum_trades":true,"july_2026_positive_net_r":true,"june_2026_minimum_trades":false,"june_2026_positive_net_r":true,"maximum_ambiguous_exits":true,"maximum_overall_drawdown_r":false,"maximum_pair_trade_share":true,"minimum_distinct_pairs":true,"minimum_overall_profit_factor":true,"minimum_total_trades":true},"passed":false},"behavior_sha256":"b4cf2ca2f3a55a7de50f3b90b0ddc9d6ba1e1d82f2f7ee7a4799575c1cd84089","candidate":{"description":"Controlled test of ema_length=45, maximum_wick_ticks=1.5 against production defaults.","name":"grid-0629","parameters":{"ema_length":45,"maximum_wick_ticks":1.5},"source_sha256":"accfdc84b139da0a1b385bdefcb55950245f61b3365b78ecee1902127222b78c"},"category":"trend-filter+wick-detection","commit":"1f86fbb3d9124a538678498bc3351851ad87b9d7","effect":"trade-changed","generated_at_utc":"2026-08-05T13:46:53+00:00","incumbent_after":"production-baseline","incumbent_before":"production-baseline","objective":{"negative_overall_drawdown_r":-5.222238,"overall_profit_factor":1.5368343118577354,"total_net_r":5.519353,"total_trades":18,"worst_fold_net_r":-3.086917},"outcome_sha256":"45c9470ee2a1914c3a7fa278a57e66a3c3b68160afb9ee15cd75897a8f4ddc65","previous_sha256":"b14fc4800dd1822984e844dc801817d69f0c9ed705d9701e9cf404af5c5c8c12","production_release_sha":"9ddd1b44aee10467247fda4627bc472ed1ff4132","record_sha256":"25ba60ed5411ba5954bbbf4041129fcc4af308fe1f88d85ab5b390436304ae22","report_sha256":"7e0d0a7f7296cad71d6467eeb15bcf17a9e61329d2886cc8633d64c428740941","run_id":"16084c10c69c8396","schema_version":2,"score":"worst_fold_net_r=-3.086917;total_net_r=5.519353;overall_profit_factor=1.5368343;negative_overall_drawdown_r=-5.222238;total_trades=18","status":"discard"}
{"acceptance_gates":{"checks":{"july_2026_minimum_trades":true,"july_2026_positive_net_r":true,"june_2026_minimum_trades":false,"june_2026_positive_net_r":true,"maximum_ambiguous_exits":true,"maximum_overall_drawdown_r":false,"maximum_pair_trade_share":true,"minimum_distinct_pairs":true,"minimum_overall_profit_factor":true,"minimum_total_trades":true},"passed":false},"behavior_sha256":"f72840faca689e77ae60587318282b91af48f1f990b786c5644f49d304de97c8","candidate":{"description":"Controlled test of maximum_wick_ticks=1.75 against production defaults.","name":"grid-0037","parameters":{"maximum_wick_ticks":1.75},"source_sha256":"28a0da9c9eb1f83832b12a18ef95d6a8a190cdb857a4d22b21b7f4b456a52e73"},"category":"wick-detection","commit":"d58638f2f1d0f239bed6ffd73e1965bb028f6301","effect":"trade-changed","generated_at_utc":"2026-08-05T13:46:58+00:00","incumbent_after":"production-baseline","incumbent_before":"production-baseline","objective":{"negative_overall_drawdown_r":-5.222238,"overall_profit_factor":1.5368343118577354,"total_net_r":5.519353,"total_trades":18,"worst_fold_net_r":-3.086917},"outcome_sha256":"45c9470ee2a1914c3a7fa278a57e66a3c3b68160afb9ee15cd75897a8f4ddc65","previous_sha256":"25ba60ed5411ba5954bbbf4041129fcc4af308fe1f88d85ab5b390436304ae22","production_release_sha":"9ddd1b44aee10467247fda4627bc472ed1ff4132","record_sha256":"874178bc0b1f26d597c9b7590f45902e5fcaba26e5b8cb4832aba223bc32ab5d","report_sha256":"b9034345c21fe4d5c45c078a5b300b61f0f8834173e3b1b8b2acc917b8dbe026","run_id":"ef79be18541c40a7","schema_version":2,"score":"worst_fold_net_r=-3.086917;total_net_r=5.519353;overall_profit_factor=1.5368343;negative_overall_drawdown_r=-5.222238;total_trades=18","status":"discard"}
{"acceptance_gates":{"checks":{"july_2026_minimum_trades":false,"july_2026_positive_net_r":true,"june_2026_minimum_trades":false,"june_2026_positive_net_r":true,"maximum_ambiguous_exits":true,"maximum_overall_drawdown_r":true,"maximum_pair_trade_share":true,"minimum_distinct_pairs":false,"minimum_overall_profit_factor":false,"minimum_total_trades":false},"passed":false},"behavior_sha256":"fb99dc571b031f76b854ba2d2bc82f3359e828c000ff8342d53ca5cd926e86d4","candidate":{"description":"Controlled test of entry_model=origin_limit, expiry_bars=2, origin_zone_atr_fraction=0.08, origin_zone_minimum_ticks=1 against production defaults.","name":"grid-0707","parameters":{"entry_model":"origin_limit","expiry_bars":2,"origin_zone_atr_fraction":0.08,"origin_zone_minimum_ticks":1},"source_sha256":"d82135ebf9f9f26c5265f04d95fbd6298c803a93f7fdf533363d81c429799a97"},"category":"entry-model","commit":"48794a705ac16477a38c761bd29a7b8414630f29","effect":"trade-changed","generated_at_utc":"2026-08-05T13:47:04+00:00","incumbent_after":"production-baseline","incumbent_before":"production-baseline","objective":{"negative_overall_drawdown_r":-2.035042,"overall_profit_factor":0.0,"total_net_r":-2.035042,"total_trades":2,"worst_fold_net_r":-2.035042},"outcome_sha256":"46aa2344ce48b7426d6fdcd5603dd9ccbf1c4d8af0747ab971d9ea60964bc41d","previous_sha256":"874178bc0b1f26d597c9b7590f45902e5fcaba26e5b8cb4832aba223bc32ab5d","production_release_sha":"9ddd1b44aee10467247fda4627bc472ed1ff4132","record_sha256":"c1e386ddd7f6a6f24262a6ef90f903027fab53ef49f911fc9675cef5b0c94fa1","report_sha256":"8fc80c3c10947740ac6aa3236b9eab00eee607a3894732ea09a5c1328283255a","run_id":"c847d0ded7c616b9","schema_version":2,"score":"worst_fold_net_r=-2.035042;total_net_r=-2.035042;overall_profit_factor=0;negative_overall_drawdown_r=-2.035042;total_trades=2","status":"discard"}
{"acceptance_gates":{"checks":{"july_2026_minimum_trades":true,"july_2026_positive_net_r":true,"june_2026_minimum_trades":true,"june_2026_positive_net_r":true,"maximum_ambiguous_exits":true,"maximum_overall_drawdown_r":false,"maximum_pair_trade_share":true,"minimum_distinct_pairs":true,"minimum_overall_profit_factor":false,"minimum_total_trades":true},"passed":false},"behavior_sha256":"21e9aac9c8611b27158e167c1212f7f3bbf1c2ba3cafa87a82906c5cbe06fb84","candidate":{"description":"Controlled test of trend_filter=none against production defaults.","name":"grid-0033","parameters":{"trend_filter":"none"},"source_sha256":"70f8ca884659e87b95c14b56dc9a2d81537c63e76cf3bf3837863019204889ad"},"category":"trend-filter","commit":"cc3b5a6a08c6a1a95c702d348fa75e7f8fb8cdff","effect":"trade-changed","generated_at_utc":"2026-08-05T13:47:09+00:00","incumbent_after":"production-baseline","incumbent_before":"production-baseline","objective":{"negative_overall_drawdown_r":-9.579093,"overall_profit_factor":1.233289197892033,"total_net_r":5.979424,"total_trades":41,"worst_fold_net_r":-0.29638699999999996},"outcome_sha256":"79919d8128daae6bb237803b050448bcb46b86ec413424fc94c6d4b146c13258","previous_sha256":"c1e386ddd7f6a6f24262a6ef90f903027fab53ef49f911fc9675cef5b0c94fa1","production_release_sha":"9ddd1b44aee10467247fda4627bc472ed1ff4132","record_sha256":"b883292610260a3a455fd46192207ea189ed7d6b8ecafcc6dd1714a552b29639","report_sha256":"839122f893dff90583cf4b28b4541b99223b834901d35532917b5bde692fdcf9","run_id":"fa576a66212976f1","schema_version":2,"score":"worst_fold_net_r=-0.296387;total_net_r=5.979424;overall_profit_factor=1.2332892;negative_overall_drawdown_r=-9.579093;total_trades=41","status":"discard"}
{"acceptance_gates":{"checks":{"july_2026_minimum_trades":true,"july_2026_positive_net_r":true,"june_2026_minimum_trades":false,"june_2026_positive_net_r":true,"maximum_ambiguous_exits":true,"maximum_overall_drawdown_r":false,"maximum_pair_trade_share":true,"minimum_distinct_pairs":true,"minimum_overall_profit_factor":true,"minimum_total_trades":true},"passed":false},"behavior_sha256":"daefbc0c9d9084e1fbd307653e8abb7351bba631cc200c65be2e3201e71a1e70","candidate":{"description":"Controlled test of ema_slope_lookback=4, tolerance_ticks=1.5 against production defaults.","name":"grid-0652","parameters":{"ema_slope_lookback":4,"tolerance_ticks":1.5},"source_sha256":"8862627003a50909761ed6d7f1bea7d4fb133aee41ac7e4e194c7f7bcd504e8b"},"category":"trend-filter+wick-detection","commit":"1ead1e93431e64362f9dcf27f12b83691b893921","effect":"trade-changed","generated_at_utc":"2026-08-05T13:47:14+00:00","incumbent_after":"production-baseline","incumbent_before":"production-baseline","objective":{"negative_overall_drawdown_r":-5.222238,"overall_profit_factor":1.5368343118577354,"total_net_r":5.519353,"total_trades":18,"worst_fold_net_r":-3.086917},"outcome_sha256":"45c9470ee2a1914c3a7fa278a57e66a3c3b68160afb9ee15cd75897a8f4ddc65","previous_sha256":"b883292610260a3a455fd46192207ea189ed7d6b8ecafcc6dd1714a552b29639","production_release_sha":"9ddd1b44aee10467247fda4627bc472ed1ff4132","record_sha256":"e701b9c1094c8e48122c98f569799870c5a7d26c5e000298fbcbacc0a9c95ab6","report_sha256":"9b5482f9a06b0bab4f9ba9c718ea95ac71084174d008334cdeaa285288845f21","run_id":"d9f1a0bfb5e9c702","schema_version":2,"score":"worst_fold_net_r=-3.086917;total_net_r=5.519353;overall_profit_factor=1.5368343;negative_overall_drawdown_r=-5.222238;total_trades=18","status":"discard"}
{"acceptance_gates":{"checks":{"july_2026_minimum_trades":true,"july_2026_positive_net_r":true,"june_2026_minimum_trades":false,"june_2026_positive_net_r":true,"maximum_ambiguous_exits":true,"maximum_overall_drawdown_r":false,"maximum_pair_trade_share":true,"minimum_distinct_pairs":true,"minimum_overall_profit_factor":true,"minimum_total_trades":true},"passed":false},"behavior_sha256":"e44bb12bd64160dbc13642eb22dc155398c88591859df1b8d588fd285ac7c683","candidate":{"description":"Controlled test of tolerance_ticks=1.5, maximum_wick_ticks=1.75 against production defaults.","name":"grid-0694","parameters":{"maximum_wick_ticks":1.75,"tolerance_ticks":1.5},"source_sha256":"cfaa96770b8d8c3821045294d11def21d6d524cfded627fc5730c9fbd3070424"},"category":"wick-detection","commit":"d2fc9dd16810fbc3cf4c18423a563bed79a4fc52","effect":"trade-changed","generated_at_utc":"2026-08-05T13:47:19+00:00","incumbent_after":"production-baseline","incumbent_before":"production-baseline","objective":{"negative_overall_drawdown_r":-5.222238,"overall_profit_factor":1.5368343118577354,"total_net_r":5.519353,"total_trades":18,"worst_fold_net_r":-3.086917},"outcome_sha256":"45c9470ee2a1914c3a7fa278a57e66a3c3b68160afb9ee15cd75897a8f4ddc65","previous_sha256":"e701b9c1094c8e48122c98f569799870c5a7d26c5e000298fbcbacc0a9c95ab6","production_release_sha":"9ddd1b44aee10467247fda4627bc472ed1ff4132","record_sha256":"443b1e0d4e850d293144df2e904ed8982034c303cd17a675892a3ef98366be69","report_sha256":"cebb6174abd48bb9cf23a44d741dea3133c3575bf436d90f95dc6f068fe790d4","run_id":"6a0cd6068951397c","schema_version":2,"score":"worst_fold_net_r=-3.086917;total_net_r=5.519353;overall_profit_factor=1.5368343;negative_overall_drawdown_r=-5.222238;total_trades=18","status":"discard"}
