{"acceptance_gates":{"checks":{"july_2026_minimum_trades":true,"july_2026_positive_net_r":true,"june_2026_minimum_trades":true,"june_2026_positive_net_r":false,"maximum_ambiguous_exits":true,"maximum_overall_drawdown_r":true,"maximum_pair_trade_share":true,"minimum_distinct_pairs":true,"minimum_overall_profit_factor":true,"minimum_total_trades":true},"passed":false},"candidate":{"description":"Wickless-candle production defaults at 12250ed.","name":"production-baseline","parameters":{},"source_sha256":"7c68bf979e09fbeb690ada96bd5c1eb01988101139b1ebf7b165972175506bea"},"commit":"3dda27a6aa3e4f706e45154d2198e0318cac8b3d","generated_at_utc":"2026-08-01T20:29:33+00:00","incumbent_after":"production-baseline","incumbent_before":"production-baseline","objective":{"negative_overall_drawdown_r":-2.141029,"overall_profit_factor":2.883638020924143,"total_net_r":11.613768,"total_trades":15,"worst_fold_net_r":-2.064939},"previous_sha256":"0000000000000000000000000000000000000000000000000000000000000000","record_sha256":"e9e5d7e8b0bb271d3ea7cb254ff241bdf7ebadf4205b4f6e7fbf6f03afa49254","report_sha256":"bf155f85c5a6ba089f1cf399c7e040133ec15ae919c2c49ad69828bea6990aa5","run_id":"8a64f3d9362b86fe","schema_version":1,"status":"keep"}
{"acceptance_gates":{"checks":{"july_2026_minimum_trades":true,"july_2026_positive_net_r":true,"june_2026_minimum_trades":false,"june_2026_positive_net_r":true,"maximum_ambiguous_exits":true,"maximum_overall_drawdown_r":false,"maximum_pair_trade_share":true,"minimum_distinct_pairs":true,"minimum_overall_profit_factor":true,"minimum_total_trades":true},"passed":false},"benchmark_role":"production-reference","candidate":{"description":"Immutable Wickless production defaults with the London-New York session union at 9ddd1b44.","name":"production-baseline","parameters":{},"source_sha256":"857a757fddadb5695add31a86afe0e2695f77358969e63cdbe8d101690fa0a27"},"category":"baseline","commit":"41e1cb86f00e67cf604034cc4b4236c208d6f269","generated_at_utc":"2026-08-05T12:25:24+00:00","incumbent_after":"production-baseline","incumbent_before":null,"objective":{"negative_overall_drawdown_r":-5.222238,"overall_profit_factor":1.7292928119866589,"total_net_r":7.498075999999999,"total_trades":19,"worst_fold_net_r":-3.086917},"previous_sha256":"e9e5d7e8b0bb271d3ea7cb254ff241bdf7ebadf4205b4f6e7fbf6f03afa49254","record_sha256":"7bb54d8246480e6f99ea0ac6784f0a1e109100a677c5ee44a1221e540dbdd0b5","report_sha256":"c25bafcb228b586e527bb292bf3ea128b4a765ba6242cde9e077d2dbe0b5ca66","run_id":"0797cc1e269a44c8","schema_version":1,"score":"worst_fold_net_r=-3.086917;total_net_r=7.498076;overall_profit_factor=1.7292928;negative_overall_drawdown_r=-5.222238;total_trades=19","status":"keep"}
{"acceptance_gates":{"checks":{"july_2026_minimum_trades":true,"july_2026_positive_net_r":true,"june_2026_minimum_trades":false,"june_2026_positive_net_r":true,"maximum_ambiguous_exits":true,"maximum_overall_drawdown_r":false,"maximum_pair_trade_share":true,"minimum_distinct_pairs":true,"minimum_overall_profit_factor":true,"minimum_total_trades":true},"passed":false},"candidate":{"description":"Controlled test of minimum_body_ratio=0.82 against production defaults.","name":"grid-0001","parameters":{"minimum_body_ratio":0.82},"source_sha256":"cd643623a36616e6172cddef112668c8397faec5b602b3c001ad673dc47bed1a"},"category":"candle-quality","commit":"9a6e9d59713b5bcd7956800ca4aaa6b69a4b36f9","generated_at_utc":"2026-08-05T12:28:14+00:00","incumbent_after":"production-baseline","incumbent_before":"production-baseline","objective":{"negative_overall_drawdown_r":-5.222238,"overall_profit_factor":1.7292928119866589,"total_net_r":7.498075999999999,"total_trades":19,"worst_fold_net_r":-3.086917},"previous_sha256":"7bb54d8246480e6f99ea0ac6784f0a1e109100a677c5ee44a1221e540dbdd0b5","record_sha256":"2e9ae2f6a9610e8cc382fe87d6cc547d503f1d1b4802773c7df4945618fa3992","report_sha256":"7fe2331aab72dd35a59207d4a13cb19666dd8806d4f93e65e67de1aad20ef6de","run_id":"a2ca0aea7b213f87","schema_version":1,"score":"worst_fold_net_r=-3.086917;total_net_r=7.498076;overall_profit_factor=1.7292928;negative_overall_drawdown_r=-5.222238;total_trades=19","status":"discard"}
{"acceptance_gates":{"checks":{"july_2026_minimum_trades":true,"july_2026_positive_net_r":true,"june_2026_minimum_trades":false,"june_2026_positive_net_r":true,"maximum_ambiguous_exits":true,"maximum_overall_drawdown_r":false,"maximum_pair_trade_share":true,"minimum_distinct_pairs":true,"minimum_overall_profit_factor":true,"minimum_total_trades":true},"passed":false},"candidate":{"description":"Controlled test of minimum_body_ratio=0.81 against production defaults.","name":"grid-0002","parameters":{"minimum_body_ratio":0.81},"source_sha256":"ab37d0599be587409a9518b016372958477076a2c5338d43da3fdc6239d8be0c"},"category":"candle-quality","commit":"a72b6dbbce91e4b5d426285c9e319565283c0286","generated_at_utc":"2026-08-05T12:28:19+00:00","incumbent_after":"production-baseline","incumbent_before":"production-baseline","objective":{"negative_overall_drawdown_r":-5.222238,"overall_profit_factor":1.7292928119866589,"total_net_r":7.498075999999999,"total_trades":19,"worst_fold_net_r":-3.086917},"previous_sha256":"2e9ae2f6a9610e8cc382fe87d6cc547d503f1d1b4802773c7df4945618fa3992","record_sha256":"76c7438be7aa1984630326707c5e52d7917230901e1aef6f9b9a0e6f19ea8444","report_sha256":"e604eb905a930395209cacadab325e4748abc2f13ab36dc1314507c5cc345455","run_id":"0c6dee8639877760","schema_version":1,"score":"worst_fold_net_r=-3.086917;total_net_r=7.498076;overall_profit_factor=1.7292928;negative_overall_drawdown_r=-5.222238;total_trades=19","status":"discard"}
{"acceptance_gates":{"checks":{"july_2026_minimum_trades":true,"july_2026_positive_net_r":true,"june_2026_minimum_trades":false,"june_2026_positive_net_r":true,"maximum_ambiguous_exits":true,"maximum_overall_drawdown_r":false,"maximum_pair_trade_share":true,"minimum_distinct_pairs":true,"minimum_overall_profit_factor":true,"minimum_total_trades":true},"passed":false},"candidate":{"description":"Controlled test of minimum_body_ratio=0.79 against production defaults.","name":"grid-0003","parameters":{"minimum_body_ratio":0.79},"source_sha256":"b6bba5f6ee6295ae8608b77422413a09dd9714bc275b5f9491eb9e265b1c04f5"},"category":"candle-quality","commit":"4ad404daeede8c9b43e62d0a17ef192e822940e1","generated_at_utc":"2026-08-05T12:28:23+00:00","incumbent_after":"production-baseline","incumbent_before":"production-baseline","objective":{"negative_overall_drawdown_r":-5.222238,"overall_profit_factor":1.7292928119866589,"total_net_r":7.498075999999999,"total_trades":19,"worst_fold_net_r":-3.086917},"previous_sha256":"76c7438be7aa1984630326707c5e52d7917230901e1aef6f9b9a0e6f19ea8444","record_sha256":"f7c458ed3d838a37cec1512529c662ed14064854dd4882cd667a834e7734325f","report_sha256":"3f8cfa424831ce59ee00a449b257659855b187c21143a96cde93fd69907a6580","run_id":"062c65d1cd4fcb70","schema_version":1,"score":"worst_fold_net_r=-3.086917;total_net_r=7.498076;overall_profit_factor=1.7292928;negative_overall_drawdown_r=-5.222238;total_trades=19","status":"discard"}
{"acceptance_gates":{"checks":{"july_2026_minimum_trades":true,"july_2026_positive_net_r":true,"june_2026_minimum_trades":false,"june_2026_positive_net_r":true,"maximum_ambiguous_exits":true,"maximum_overall_drawdown_r":false,"maximum_pair_trade_share":true,"minimum_distinct_pairs":true,"minimum_overall_profit_factor":true,"minimum_total_trades":true},"passed":false},"candidate":{"description":"Controlled test of minimum_body_ratio=0.78 against production defaults.","name":"grid-0004","parameters":{"minimum_body_ratio":0.78},"source_sha256":"d28b1e00d51fcc3926321f0bbd2e34e370179a1d71f219bb7c8f803064c4ad5c"},"category":"candle-quality","commit":"66018f44636dc7d7f34ead9825283efc6b060a8c","generated_at_utc":"2026-08-05T12:28:28+00:00","incumbent_after":"production-baseline","incumbent_before":"production-baseline","objective":{"negative_overall_drawdown_r":-5.222238,"overall_profit_factor":1.7292928119866589,"total_net_r":7.498075999999999,"total_trades":19,"worst_fold_net_r":-3.086917},"previous_sha256":"f7c458ed3d838a37cec1512529c662ed14064854dd4882cd667a834e7734325f","record_sha256":"bf56fcba5790b5db334c6f6cf8d6087e4ed629756897321106f6850c95462303","report_sha256":"87b8cf7dd06174a3923f16b5e28be9ea34489e03508371d6f166728098502f1b","run_id":"4b9f58ec9316aef5","schema_version":1,"score":"worst_fold_net_r=-3.086917;total_net_r=7.498076;overall_profit_factor=1.7292928;negative_overall_drawdown_r=-5.222238;total_trades=19","status":"discard"}
{"acceptance_gates":{"checks":{"july_2026_minimum_trades":true,"july_2026_positive_net_r":true,"june_2026_minimum_trades":false,"june_2026_positive_net_r":true,"maximum_ambiguous_exits":true,"maximum_overall_drawdown_r":false,"maximum_pair_trade_share":true,"minimum_distinct_pairs":true,"minimum_overall_profit_factor":true,"minimum_total_trades":true},"passed":false},"candidate":{"description":"Controlled test of minimum_body_ratio=0.84 against production defaults.","name":"grid-0005","parameters":{"minimum_body_ratio":0.84},"source_sha256":"8985a9e34a26db2cb837e4745f6f2b0d204c1e782a278a4f0ba010f920acf58b"},"category":"candle-quality","commit":"c3ef4e7512786cb9a0a7136ee4f7282709ff3c83","generated_at_utc":"2026-08-05T12:28:32+00:00","incumbent_after":"production-baseline","incumbent_before":"production-baseline","objective":{"negative_overall_drawdown_r":-5.222238,"overall_profit_factor":1.7292928119866589,"total_net_r":7.498075999999999,"total_trades":19,"worst_fold_net_r":-3.086917},"previous_sha256":"bf56fcba5790b5db334c6f6cf8d6087e4ed629756897321106f6850c95462303","record_sha256":"c4e226e607dd16e3e1ed578df6daa9e7d4e335262177e9f395c40d4e38e6ce8c","report_sha256":"65fed91b425f5fa35a539b78019353a3ef92572e49ca8130b2e896a189dc74f3","run_id":"3318af235476d727","schema_version":1,"score":"worst_fold_net_r=-3.086917;total_net_r=7.498076;overall_profit_factor=1.7292928;negative_overall_drawdown_r=-5.222238;total_trades=19","status":"discard"}
{"acceptance_gates":{"checks":{"july_2026_minimum_trades":true,"july_2026_positive_net_r":true,"june_2026_minimum_trades":false,"june_2026_positive_net_r":true,"maximum_ambiguous_exits":true,"maximum_overall_drawdown_r":false,"maximum_pair_trade_share":true,"minimum_distinct_pairs":true,"minimum_overall_profit_factor":true,"minimum_total_trades":true},"passed":false},"candidate":{"description":"Controlled test of minimum_body_ratio=0.76 against production defaults.","name":"grid-0006","parameters":{"minimum_body_ratio":0.76},"source_sha256":"12e9fc8803aa16f21af031c8a22da0447236f166c6359d62219c5ccf4749c8db"},"category":"candle-quality","commit":"ff71fda3c368ea284055eb65871c7731a32d43eb","generated_at_utc":"2026-08-05T12:28:37+00:00","incumbent_after":"production-baseline","incumbent_before":"production-baseline","objective":{"negative_overall_drawdown_r":-5.222238,"overall_profit_factor":1.7292928119866589,"total_net_r":7.498075999999999,"total_trades":19,"worst_fold_net_r":-3.086917},"previous_sha256":"c4e226e607dd16e3e1ed578df6daa9e7d4e335262177e9f395c40d4e38e6ce8c","record_sha256":"6efa023510410751dd1a5e4a2ea899b00b7f73296d7c0ccb69fcab814578295a","report_sha256":"684c974c95f7a3b9163d0bc9b5df1ef33cc9988f87249d49335baf7808b15447","run_id":"63609e1cc449a1c5","schema_version":1,"score":"worst_fold_net_r=-3.086917;total_net_r=7.498076;overall_profit_factor=1.7292928;negative_overall_drawdown_r=-5.222238;total_trades=19","status":"discard"}
{"acceptance_gates":{"checks":{"july_2026_minimum_trades":true,"july_2026_positive_net_r":true,"june_2026_minimum_trades":false,"june_2026_positive_net_r":true,"maximum_ambiguous_exits":true,"maximum_overall_drawdown_r":false,"maximum_pair_trade_share":true,"minimum_distinct_pairs":true,"minimum_overall_profit_factor":true,"minimum_total_trades":true},"passed":false},"candidate":{"description":"Controlled test of minimum_range_atr=0.52 against production defaults.","name":"grid-0007","parameters":{"minimum_range_atr":0.52},"source_sha256":"116f82858d83a104b8bf00f8981d9ae5619e682856cefe5c7c0df51304ef7d24"},"category":"candle-quality","commit":"dab6349bb1a17848bbf6851ac5bf9bda67e8f82c","generated_at_utc":"2026-08-05T12:28:41+00:00","incumbent_after":"production-baseline","incumbent_before":"production-baseline","objective":{"negative_overall_drawdown_r":-5.222238,"overall_profit_factor":1.7292928119866589,"total_net_r":7.498075999999999,"total_trades":19,"worst_fold_net_r":-3.086917},"previous_sha256":"6efa023510410751dd1a5e4a2ea899b00b7f73296d7c0ccb69fcab814578295a","record_sha256":"1349920bbfe23209aa829d502ce6879494b27f0aa05be4c5bf3e809bad8dc9c8","report_sha256":"e264b040fbb16590501eb74d105e221b11f3f7ddc1a418c240c8d3f9e4aa966e","run_id":"65450a6eae3d18b0","schema_version":1,"score":"worst_fold_net_r=-3.086917;total_net_r=7.498076;overall_profit_factor=1.7292928;negative_overall_drawdown_r=-5.222238;total_trades=19","status":"discard"}
{"acceptance_gates":{"checks":{"july_2026_minimum_trades":true,"july_2026_positive_net_r":true,"june_2026_minimum_trades":false,"june_2026_positive_net_r":true,"maximum_ambiguous_exits":true,"maximum_overall_drawdown_r":false,"maximum_pair_trade_share":true,"minimum_distinct_pairs":true,"minimum_overall_profit_factor":true,"minimum_total_trades":true},"passed":false},"candidate":{"description":"Controlled test of minimum_range_atr=0.48 against production defaults.","name":"grid-0008","parameters":{"minimum_range_atr":0.48},"source_sha256":"2e4e2b37f39215b5c6d37b1cb9cbb1614c844c2d5d8aa3a7720308b546cd11dd"},"category":"candle-quality","commit":"f5620c06b58f3ad98087d10bdc81f54d4aa922f3","generated_at_utc":"2026-08-05T12:28:46+00:00","incumbent_after":"production-baseline","incumbent_before":"production-baseline","objective":{"negative_overall_drawdown_r":-5.222238,"overall_profit_factor":1.7292928119866589,"total_net_r":7.498075999999999,"total_trades":19,"worst_fold_net_r":-3.086917},"previous_sha256":"1349920bbfe23209aa829d502ce6879494b27f0aa05be4c5bf3e809bad8dc9c8","record_sha256":"2b6f716e0a40b5b4e3fcc77ae4589da9832d9227db803b654cb07b83d17df2c4","report_sha256":"80b4d4b05de72360aadee41ce051b7277404e6c491432dc55dda42341b5fc825","run_id":"3d3a32fe107365c5","schema_version":1,"score":"worst_fold_net_r=-3.086917;total_net_r=7.498076;overall_profit_factor=1.7292928;negative_overall_drawdown_r=-5.222238;total_trades=19","status":"discard"}
{"acceptance_gates":{"checks":{"july_2026_minimum_trades":true,"july_2026_positive_net_r":true,"june_2026_minimum_trades":false,"june_2026_positive_net_r":true,"maximum_ambiguous_exits":true,"maximum_overall_drawdown_r":false,"maximum_pair_trade_share":true,"minimum_distinct_pairs":true,"minimum_overall_profit_factor":true,"minimum_total_trades":true},"passed":false},"candidate":{"description":"Controlled test of minimum_range_atr=0.54 against production defaults.","name":"grid-0009","parameters":{"minimum_range_atr":0.54},"source_sha256":"eaa47771d47fdc9617536ba7384990570be618a1df08d59a71f622208aab6b95"},"category":"candle-quality","commit":"1b94efc5069fb45418b9399c53039c14b5545c90","generated_at_utc":"2026-08-05T12:28:50+00:00","incumbent_after":"production-baseline","incumbent_before":"production-baseline","objective":{"negative_overall_drawdown_r":-5.222238,"overall_profit_factor":1.7292928119866589,"total_net_r":7.498075999999999,"total_trades":19,"worst_fold_net_r":-3.086917},"previous_sha256":"2b6f716e0a40b5b4e3fcc77ae4589da9832d9227db803b654cb07b83d17df2c4","record_sha256":"7ed6bfde166999f9bde66fa484b0bf51de0beb1d61f1f4ec0be3873ef8609cae","report_sha256":"b88824908795c19769edc106b303c318bce80b737cea91d96f1c3934f3c649f5","run_id":"885e2614117e68b4","schema_version":1,"score":"worst_fold_net_r=-3.086917;total_net_r=7.498076;overall_profit_factor=1.7292928;negative_overall_drawdown_r=-5.222238;total_trades=19","status":"discard"}
{"acceptance_gates":{"checks":{"july_2026_minimum_trades":true,"july_2026_positive_net_r":true,"june_2026_minimum_trades":false,"june_2026_positive_net_r":true,"maximum_ambiguous_exits":true,"maximum_overall_drawdown_r":false,"maximum_pair_trade_share":true,"minimum_distinct_pairs":true,"minimum_overall_profit_factor":true,"minimum_total_trades":true},"passed":false},"candidate":{"description":"Controlled test of minimum_range_atr=0.46 against production defaults.","name":"grid-0010","parameters":{"minimum_range_atr":0.46},"source_sha256":"af23b86be9024c54e12ca27710b3e89ac8cf10c61b304ccc6f4f08bdbfa1966c"},"category":"candle-quality","commit":"c5a82583daa36e74abb9b18151711d0fc469a9f2","generated_at_utc":"2026-08-05T12:28:55+00:00","incumbent_after":"production-baseline","incumbent_before":"production-baseline","objective":{"negative_overall_drawdown_r":-5.222238,"overall_profit_factor":1.7292928119866589,"total_net_r":7.498075999999999,"total_trades":19,"worst_fold_net_r":-3.086917},"previous_sha256":"7ed6bfde166999f9bde66fa484b0bf51de0beb1d61f1f4ec0be3873ef8609cae","record_sha256":"4ad1b9dc80f09fb22be4f34b1b8d42e0a1d5c9558038788ef49e5efa6c726423","report_sha256":"d2ff93098401d932bc9a9992467080127e8991d2b2cd3d598b66d8ce66085b5a","run_id":"1cf6ba1b384caeb5","schema_version":1,"score":"worst_fold_net_r=-3.086917;total_net_r=7.498076;overall_profit_factor=1.7292928;negative_overall_drawdown_r=-5.222238;total_trades=19","status":"discard"}
{"acceptance_gates":{"checks":{"july_2026_minimum_trades":true,"july_2026_positive_net_r":true,"june_2026_minimum_trades":false,"june_2026_positive_net_r":true,"maximum_ambiguous_exits":true,"maximum_overall_drawdown_r":false,"maximum_pair_trade_share":true,"minimum_distinct_pairs":true,"minimum_overall_profit_factor":true,"minimum_total_trades":true},"passed":false},"candidate":{"description":"Controlled test of minimum_range_atr=0.56 against production defaults.","name":"grid-0011","parameters":{"minimum_range_atr":0.56},"source_sha256":"9bbc19094c3b07bb15d49d3cf0a4c5451d6e5e7457541b68434d170cbd20bcf9"},"category":"candle-quality","commit":"70c157590a52fa81ceaf38e289df242e870f8eef","generated_at_utc":"2026-08-05T12:28:59+00:00","incumbent_after":"production-baseline","incumbent_before":"production-baseline","objective":{"negative_overall_drawdown_r":-5.222238,"overall_profit_factor":1.7292928119866589,"total_net_r":7.498075999999999,"total_trades":19,"worst_fold_net_r":-3.086917},"previous_sha256":"4ad1b9dc80f09fb22be4f34b1b8d42e0a1d5c9558038788ef49e5efa6c726423","record_sha256":"df82bdb7dae5d1bbd02a5be9c4aa7376869f4416d802270ae07112607797cf0c","report_sha256":"e0927f70316e6c74331b879a01f4e2900322b237a5f08ef10d7d831a7691b842","run_id":"feefa353df39d48c","schema_version":1,"score":"worst_fold_net_r=-3.086917;total_net_r=7.498076;overall_profit_factor=1.7292928;negative_overall_drawdown_r=-5.222238;total_trades=19","status":"discard"}
{"acceptance_gates":{"checks":{"july_2026_minimum_trades":true,"july_2026_positive_net_r":true,"june_2026_minimum_trades":false,"june_2026_positive_net_r":true,"maximum_ambiguous_exits":true,"maximum_overall_drawdown_r":false,"maximum_pair_trade_share":true,"minimum_distinct_pairs":true,"minimum_overall_profit_factor":true,"minimum_total_trades":true},"passed":false},"candidate":{"description":"Controlled test of minimum_range_atr=0.44 against production defaults.","name":"grid-0012","parameters":{"minimum_range_atr":0.44},"source_sha256":"58a2e299412eab66f70dad693e648ff1e869c12f468dffe7a2206c49bd434576"},"category":"candle-quality","commit":"b7f8d77fb84bdff00d33142970291046e99a982c","generated_at_utc":"2026-08-05T12:29:03+00:00","incumbent_after":"production-baseline","incumbent_before":"production-baseline","objective":{"negative_overall_drawdown_r":-5.222238,"overall_profit_factor":1.7292928119866589,"total_net_r":7.498075999999999,"total_trades":19,"worst_fold_net_r":-3.086917},"previous_sha256":"df82bdb7dae5d1bbd02a5be9c4aa7376869f4416d802270ae07112607797cf0c","record_sha256":"42d43448da29347322fc127fbb4ab87a19c062f0344462f7df0bc2461dbb81a8","report_sha256":"3908afe714a930c244bcc13dadc4967c2e126658a969da8b32689fcbfa31cb7e","run_id":"e9c55dfb0bbaa9e2","schema_version":1,"score":"worst_fold_net_r=-3.086917;total_net_r=7.498076;overall_profit_factor=1.7292928;negative_overall_drawdown_r=-5.222238;total_trades=19","status":"discard"}
{"acceptance_gates":{"checks":{"july_2026_minimum_trades":true,"july_2026_positive_net_r":true,"june_2026_minimum_trades":false,"june_2026_positive_net_r":true,"maximum_ambiguous_exits":true,"maximum_overall_drawdown_r":false,"maximum_pair_trade_share":true,"minimum_distinct_pairs":true,"minimum_overall_profit_factor":true,"minimum_total_trades":true},"passed":false},"behavior_sha256":"35a378d8fb47974bb88216c867c7b66f88d52f7e3c490f18ef88988963e0573c","benchmark_role":"production-reference","candidate":{"description":"Immutable Wickless production defaults with the London-New York session union at 9ddd1b44.","name":"production-baseline","parameters":{},"source_sha256":"857a757fddadb5695add31a86afe0e2695f77358969e63cdbe8d101690fa0a27"},"category":"baseline","commit":"f0e75b8a19a2e86d51b99d233ebc2a2a9bd636a7","effect":"baseline","generated_at_utc":"2026-08-05T13:30:35+00:00","incumbent_after":"production-baseline","incumbent_before":null,"objective":{"negative_overall_drawdown_r":-5.222238,"overall_profit_factor":1.7292928119866589,"total_net_r":7.498075999999999,"total_trades":19,"worst_fold_net_r":-3.086917},"previous_sha256":"42d43448da29347322fc127fbb4ab87a19c062f0344462f7df0bc2461dbb81a8","production_release_sha":"9ddd1b44aee10467247fda4627bc472ed1ff4132","record_sha256":"70e0f3f60d558dab7df7d3dc918d3162039b78934809706ee3b8f3f0d73127e7","report_sha256":"9ca272f34275af9bcaefb6ea2e4fa419912844306e564fd18a9d9ebd733fef07","run_id":"40ba559cfec696f5","schema_version":2,"score":"worst_fold_net_r=-3.086917;total_net_r=7.498076;overall_profit_factor=1.7292928;negative_overall_drawdown_r=-5.222238;total_trades=19","status":"keep"}
