{"acceptance_gates":{"checks":{"april_2026_minimum_trades":true,"april_2026_positive_net_r":true,"august_2025_minimum_trades":true,"august_2025_positive_net_r":true,"december_2025_minimum_trades":true,"december_2025_positive_net_r":true,"february_2026_minimum_trades":true,"february_2026_positive_net_r":true,"january_2026_minimum_trades":true,"january_2026_positive_net_r":true,"july_2026_minimum_trades":true,"july_2026_positive_net_r":true,"june_2026_minimum_trades":false,"june_2026_positive_net_r":true,"march_2026_minimum_trades":true,"march_2026_positive_net_r":true,"maximum_ambiguous_exits":false,"maximum_overall_drawdown_r":false,"maximum_pair_trade_share":true,"maximum_single_fold_profit_share":false,"may_2026_minimum_trades":true,"may_2026_positive_net_r":true,"minimum_bootstrap_mean_fold_net_r_lower":false,"minimum_bootstrap_probability_mean_positive":false,"minimum_distinct_pairs":true,"minimum_overall_profit_factor":false,"minimum_profitable_fold_ratio":false,"minimum_total_trades":true,"minimum_worst_rolling_three_fold_net_r":false,"neighbourhood_robustness":true,"november_2025_minimum_trades":true,"november_2025_positive_net_r":true,"october_2025_minimum_trades":true,"october_2025_positive_net_r":true,"september_2025_minimum_trades":true,"september_2025_positive_net_r":true},"passed":false},"behavior_sha256":"467978fb14047486d915804ff22a64712c030f200ee0ee259046d40ca76cdeff","benchmark_role":"production-reference","candidate":{"description":"Immutable Wickless production defaults with the London-New York session union at 9ddd1b44.","name":"production-baseline","parameters":{},"source_sha256":"857a757fddadb5695add31a86afe0e2695f77358969e63cdbe8d101690fa0a27"},"category":"baseline","commit":"df7720c78f91fa055f1e38e0e40ba32fa6eee8dc","effect":"baseline","generated_at_utc":"2026-09-04T21:47:05+00:00","incumbent_after":"production-baseline","incumbent_before":null,"objective":{"negative_overall_drawdown_r":-31.38749000000001,"overall_profit_factor":0.8651268270672711,"total_net_r":-15.420716,"total_trades":162,"worst_fold_net_r":-7.327845},"previous_sha256":"443b1e0d4e850d293144df2e904ed8982034c303cd17a675892a3ef98366be69","production_release_sha":"9ddd1b44aee10467247fda4627bc472ed1ff4132","record_sha256":"7a646376882d291c36a7170f9a8783c855d2e93bc20654281dc7c8a4f50156f9","report_sha256":"bc7eb56e2f4fdb1783e6764eb5f2f8f466b74f3061c9de0d4ca47c41c0a543fe","run_id":"3a797861af4e4c4c","schema_version":3,"score":"worst_fold_net_r=-7.327845;total_net_r=-15.420716;overall_profit_factor=0.86512683;negative_overall_drawdown_r=-31.38749;total_trades=162","status":"keep","validation_profile_sha256":"f02bfcf78d0fa2799c68ef4a7129ec5f635ce27ec3fe3a5267a7d0cfa3ed7afb"}
{"acceptance_gates":{"checks":{"april_2026_minimum_trades":true,"april_2026_positive_net_r":true,"august_2025_minimum_trades":true,"august_2025_positive_net_r":true,"december_2025_minimum_trades":true,"december_2025_positive_net_r":true,"february_2026_minimum_trades":true,"february_2026_positive_net_r":true,"january_2026_minimum_trades":true,"january_2026_positive_net_r":true,"july_2026_minimum_trades":false,"july_2026_positive_net_r":true,"june_2026_minimum_trades":false,"june_2026_positive_net_r":true,"march_2026_minimum_trades":true,"march_2026_positive_net_r":true,"maximum_ambiguous_exits":true,"maximum_overall_drawdown_r":false,"maximum_pair_trade_share":true,"maximum_single_fold_profit_share":false,"may_2026_minimum_trades":true,"may_2026_positive_net_r":true,"minimum_bootstrap_mean_fold_net_r_lower":false,"minimum_bootstrap_probability_mean_positive":false,"minimum_distinct_pairs":true,"minimum_overall_profit_factor":false,"minimum_profitable_fold_ratio":false,"minimum_total_trades":false,"minimum_worst_rolling_three_fold_net_r":false,"neighbourhood_robustness":false,"november_2025_minimum_trades":true,"november_2025_positive_net_r":true,"october_2025_minimum_trades":true,"october_2025_positive_net_r":true,"september_2025_minimum_trades":true,"september_2025_positive_net_r":true},"passed":false},"behavior_sha256":"7c6158c1662357b964236b5ed039e876712c7c09e049a78b8a71f41dcf2362bc","candidate":{"description":"Controlled test of entry_model=zone_reclaim, expiry_bars=6, origin_zone_atr_fraction=0.16, reclaim_buffer_ticks=1, maximum_entry_displacement_atr=0.34 against production defaults.","name":"grid-0705","parameters":{"entry_model":"zone_reclaim","expiry_bars":6,"maximum_entry_displacement_atr":0.34,"origin_zone_atr_fraction":0.16,"reclaim_buffer_ticks":1},"source_sha256":"bb182478db1804cb47997d8893397e4375cda6b530ba110aa1feace4b77cc700"},"category":"entry-model","commit":"df7720c78f91fa055f1e38e0e40ba32fa6eee8dc","effect":"trade-changed","generated_at_utc":"2026-09-04T21:47:45+00:00","incumbent_after":"production-baseline","incumbent_before":"production-baseline","objective":{"negative_overall_drawdown_r":-10.287349000000003,"overall_profit_factor":0.729182865213708,"total_net_r":-4.419285,"total_trades":22,"worst_fold_net_r":-3.049341},"outcome_sha256":"1b71c2a78c57cdd85650b23275d51f07068a59fa80ba496620860e3973bc57a0","previous_sha256":"7a646376882d291c36a7170f9a8783c855d2e93bc20654281dc7c8a4f50156f9","production_release_sha":"9ddd1b44aee10467247fda4627bc472ed1ff4132","record_sha256":"008e238303157c88f47a5eb937ae32596689e230778bd6254a873f98199e9f56","report_sha256":"16dab9d33cbc888c19553ed87c3b2ee9a1bb87d038556e82a9b5dcad39255f78","run_id":"b55aeac23569cdde","schema_version":3,"score":"worst_fold_net_r=-3.049341;total_net_r=-4.419285;overall_profit_factor=0.72918287;negative_overall_drawdown_r=-10.287349;total_trades=22","status":"discard","validation":{"dataset_directory":"dukascopy_m1_bidask_2025-05_2026-07","diagnostics":{"annualized_fold_sharpe":-0.7701905286463292,"bootstrap":{"block_size":3,"confidence_level":0.9,"mean_fold_net_r_lower":-1.0312420833333333,"mean_fold_net_r_upper":0.29611425,"method":"deterministic-circular-moving-block","probability_mean_positive":0.1895,"samples":2000},"fold_count":12,"fold_net_r":[-0.04087700000000005,0.0,-3.049341,-1.021505,-1.073871,-0.05063300000000015,0.0,-1.013333,0.0,0.0,-2.0518739999999998,3.882149],"fold_net_r_stdev":1.6563923402564396,"largest_profitable_fold_share":1.0,"mean_fold_net_r":-0.36827375,"median_fold_net_r":-0.0457550000000001,"multiple_testing":{"bonferroni_adjusted_confidence":0.0,"prior_candidate_trials":37,"promotion_gate":false,"raw_probability_mean_positive":0.1895,"selection_bias_risk":"high","trials_including_current":38},"nonnegative_fold_ratio":0.4166666666666667,"one_sided_sign_test_p_value":0.999755859375,"profitable_fold_count":1,"profitable_fold_ratio":0.08333333333333333,"worst_rolling_three_fold_net_r":-5.144717},"neighbourhood_robustness":{"passed":false,"status":"not-run-base-gates-failed"},"profile":"phase1-walk-forward-v1","profile_sha256":"f02bfcf78d0fa2799c68ef4a7129ec5f635ce27ec3fe3a5267a7d0cfa3ed7afb"},"validation_profile_sha256":"f02bfcf78d0fa2799c68ef4a7129ec5f635ce27ec3fe3a5267a7d0cfa3ed7afb"}
{"acceptance_gates":{"checks":{"april_2026_minimum_trades":true,"april_2026_positive_net_r":true,"august_2025_minimum_trades":true,"august_2025_positive_net_r":true,"december_2025_minimum_trades":true,"december_2025_positive_net_r":true,"february_2026_minimum_trades":true,"february_2026_positive_net_r":true,"january_2026_minimum_trades":true,"january_2026_positive_net_r":true,"july_2026_minimum_trades":true,"july_2026_positive_net_r":true,"june_2026_minimum_trades":false,"june_2026_positive_net_r":true,"march_2026_minimum_trades":true,"march_2026_positive_net_r":true,"maximum_ambiguous_exits":false,"maximum_overall_drawdown_r":false,"maximum_pair_trade_share":true,"maximum_single_fold_profit_share":false,"may_2026_minimum_trades":true,"may_2026_positive_net_r":true,"minimum_bootstrap_mean_fold_net_r_lower":false,"minimum_bootstrap_probability_mean_positive":false,"minimum_distinct_pairs":true,"minimum_overall_profit_factor":false,"minimum_profitable_fold_ratio":false,"minimum_total_trades":true,"minimum_worst_rolling_three_fold_net_r":false,"neighbourhood_robustness":false,"november_2025_minimum_trades":true,"november_2025_positive_net_r":true,"october_2025_minimum_trades":true,"october_2025_positive_net_r":true,"september_2025_minimum_trades":true,"september_2025_positive_net_r":true},"passed":false},"behavior_sha256":"02fce6429beb7d95b16d591211d189cb65ccf58e6096acd55b119f8570f908d9","candidate":{"description":"Controlled test of ema_length=40 against production defaults.","name":"grid-0023","parameters":{"ema_length":40},"source_sha256":"7e3e928f1384e73aa8be4846151b495643a77799c9d065c30439408a77ac36ba"},"category":"trend-filter","commit":"df7720c78f91fa055f1e38e0e40ba32fa6eee8dc","effect":"trade-changed","generated_at_utc":"2026-09-04T21:48:26+00:00","incumbent_after":"production-baseline","incumbent_before":"production-baseline","objective":{"negative_overall_drawdown_r":-28.346239999999998,"overall_profit_factor":0.9068707556127572,"total_net_r":-10.363043,"total_trades":160,"worst_fold_net_r":-8.268977},"outcome_sha256":"7531e2d46d74f8ae7159dae768a6bc1690beaa60a15c2fd811f01722433532a4","previous_sha256":"008e238303157c88f47a5eb937ae32596689e230778bd6254a873f98199e9f56","production_release_sha":"9ddd1b44aee10467247fda4627bc472ed1ff4132","record_sha256":"54a3e5ef6713bbcdda328745864caea1e07d146a68266d55cc79628e25bc97eb","report_sha256":"8ec9984cd4c7233b7e5f2541d6d2c79328b6af1ed1d42c4070c7a5ef868400a4","run_id":"2e25165d7edee4ee","schema_version":3,"score":"worst_fold_net_r=-8.268977;total_net_r=-10.363043;overall_profit_factor=0.90687076;negative_overall_drawdown_r=-28.34624;total_trades=160","status":"discard","validation":{"dataset_directory":"dukascopy_m1_bidask_2025-05_2026-07","diagnostics":{"annualized_fold_sharpe":-0.5816668451745318,"bootstrap":{"block_size":3,"confidence_level":0.9,"mean_fold_net_r_lower":-3.2866880833333334,"mean_fold_net_r_upper":1.4147045,"method":"deterministic-circular-moving-block","probability_mean_positive":0.2835,"samples":2000},"fold_count":12,"fold_net_r":[2.7035530000000003,-6.3610050000000005,-8.268977,-4.224317,-4.292627,2.706194,-3.2941419999999995,4.667039000000001,1.567293,-2.03913,-3.086917,9.559993],"fold_net_r_stdev":5.143069194427274,"largest_profitable_fold_share":0.4508564675690594,"mean_fold_net_r":-0.8635869166666665,"median_fold_net_r":-2.5630235,"multiple_testing":{"bonferroni_adjusted_confidence":0.0,"prior_candidate_trials":38,"promotion_gate":false,"raw_probability_mean_positive":0.2835,"selection_bias_risk":"high","trials_including_current":39},"nonnegative_fold_ratio":0.4166666666666667,"one_sided_sign_test_p_value":0.80615234375,"profitable_fold_count":5,"profitable_fold_ratio":0.4166666666666667,"worst_rolling_three_fold_net_r":-18.854299},"neighbourhood_robustness":{"passed":false,"status":"not-run-base-gates-failed"},"profile":"phase1-walk-forward-v1","profile_sha256":"f02bfcf78d0fa2799c68ef4a7129ec5f635ce27ec3fe3a5267a7d0cfa3ed7afb"},"validation_profile_sha256":"f02bfcf78d0fa2799c68ef4a7129ec5f635ce27ec3fe3a5267a7d0cfa3ed7afb"}
{"acceptance_gates":{"checks":{"april_2026_minimum_trades":true,"april_2026_positive_net_r":true,"august_2025_minimum_trades":true,"august_2025_positive_net_r":true,"december_2025_minimum_trades":true,"december_2025_positive_net_r":true,"february_2026_minimum_trades":true,"february_2026_positive_net_r":true,"january_2026_minimum_trades":true,"january_2026_positive_net_r":true,"july_2026_minimum_trades":false,"july_2026_positive_net_r":true,"june_2026_minimum_trades":false,"june_2026_positive_net_r":true,"march_2026_minimum_trades":true,"march_2026_positive_net_r":true,"maximum_ambiguous_exits":false,"maximum_overall_drawdown_r":false,"maximum_pair_trade_share":true,"maximum_single_fold_profit_share":true,"may_2026_minimum_trades":true,"may_2026_positive_net_r":true,"minimum_bootstrap_mean_fold_net_r_lower":false,"minimum_bootstrap_probability_mean_positive":false,"minimum_distinct_pairs":true,"minimum_overall_profit_factor":false,"minimum_profitable_fold_ratio":false,"minimum_total_trades":true,"minimum_worst_rolling_three_fold_net_r":false,"neighbourhood_robustness":false,"november_2025_minimum_trades":true,"november_2025_positive_net_r":true,"october_2025_minimum_trades":true,"october_2025_positive_net_r":true,"september_2025_minimum_trades":true,"september_2025_positive_net_r":true},"passed":false},"behavior_sha256":"0ea9509ea9ec8a1fa78435f9ce2c3cc4e8662b8e8e54eb4bc880b43f75cf4008","candidate":{"description":"Controlled test of ema_length=45, tolerance_ticks=0.5 against production defaults.","name":"grid-0612","parameters":{"ema_length":45,"tolerance_ticks":0.5},"source_sha256":"be96b208fb24a8ceeaef1eb2baadc99bea4516474ef23f588275e7cfb3d4e160"},"category":"trend-filter+wick-detection","commit":"df7720c78f91fa055f1e38e0e40ba32fa6eee8dc","effect":"trade-changed","generated_at_utc":"2026-09-04T21:49:06+00:00","incumbent_after":"production-baseline","incumbent_before":"production-baseline","objective":{"negative_overall_drawdown_r":-14.940806,"overall_profit_factor":1.090117964209531,"total_net_r":5.236961,"total_trades":89,"worst_fold_net_r":-4.268552},"outcome_sha256":"650691e33360af949e071964c671d204963adb80f48859a5a053bbfd2ca97c2f","previous_sha256":"54a3e5ef6713bbcdda328745864caea1e07d146a68266d55cc79628e25bc97eb","production_release_sha":"9ddd1b44aee10467247fda4627bc472ed1ff4132","record_sha256":"89eb5bf6d45b763b360dcae45b4dd08b5596708f14a187efb79713fd16adcaf8","report_sha256":"c5323bd2590b33f1de8d2ba8e65bd44d9c5f575bcfc891a9e015220936597a8d","run_id":"7ec6d99c15fb3b0d","schema_version":3,"score":"worst_fold_net_r=-4.268552;total_net_r=5.236961;overall_profit_factor=1.090118;negative_overall_drawdown_r=-14.940806;total_trades=89","status":"discard","validation":{"dataset_directory":"dukascopy_m1_bidask_2025-05_2026-07","diagnostics":{"annualized_fold_sharpe":0.4143147078878775,"bootstrap":{"block_size":3,"confidence_level":0.9,"mean_fold_net_r_lower":-1.24886575,"mean_fold_net_r_upper":2.0242078666666665,"method":"deterministic-circular-moving-block","probability_mean_positive":0.6575,"samples":2000},"fold_count":12,"fold_net_r":[2.7699350000000003,-4.268552,-3.118131,-3.1185540000000005,-1.147626,2.836993,-3.1820319999999995,5.852645,3.752695,-1.017391,0.0,5.876979],"fold_net_r_stdev":3.648869790912435,"largest_profitable_fold_share":0.27867182740094987,"mean_fold_net_r":0.4364134166666668,"median_fold_net_r":-0.5086955,"multiple_testing":{"bonferroni_adjusted_confidence":0.0,"prior_candidate_trials":39,"promotion_gate":false,"raw_probability_mean_positive":0.6575,"selection_bias_risk":"high","trials_including_current":40},"nonnegative_fold_ratio":0.5,"one_sided_sign_test_p_value":0.80615234375,"profitable_fold_count":5,"profitable_fold_ratio":0.4166666666666667,"worst_rolling_three_fold_net_r":-10.505237000000001},"neighbourhood_robustness":{"passed":false,"status":"not-run-base-gates-failed"},"profile":"phase1-walk-forward-v1","profile_sha256":"f02bfcf78d0fa2799c68ef4a7129ec5f635ce27ec3fe3a5267a7d0cfa3ed7afb"},"validation_profile_sha256":"f02bfcf78d0fa2799c68ef4a7129ec5f635ce27ec3fe3a5267a7d0cfa3ed7afb"}
{"acceptance_gates":{"checks":{"april_2026_minimum_trades":true,"april_2026_positive_net_r":true,"august_2025_minimum_trades":true,"august_2025_positive_net_r":true,"december_2025_minimum_trades":true,"december_2025_positive_net_r":true,"february_2026_minimum_trades":true,"february_2026_positive_net_r":true,"january_2026_minimum_trades":true,"january_2026_positive_net_r":true,"july_2026_minimum_trades":false,"july_2026_positive_net_r":true,"june_2026_minimum_trades":false,"june_2026_positive_net_r":true,"march_2026_minimum_trades":true,"march_2026_positive_net_r":true,"maximum_ambiguous_exits":false,"maximum_overall_drawdown_r":false,"maximum_pair_trade_share":true,"maximum_single_fold_profit_share":true,"may_2026_minimum_trades":true,"may_2026_positive_net_r":true,"minimum_bootstrap_mean_fold_net_r_lower":false,"minimum_bootstrap_probability_mean_positive":false,"minimum_distinct_pairs":true,"minimum_overall_profit_factor":false,"minimum_profitable_fold_ratio":false,"minimum_total_trades":true,"minimum_worst_rolling_three_fold_net_r":false,"neighbourhood_robustness":false,"november_2025_minimum_trades":true,"november_2025_positive_net_r":true,"october_2025_minimum_trades":true,"october_2025_positive_net_r":true,"september_2025_minimum_trades":true,"september_2025_positive_net_r":true},"passed":false},"behavior_sha256":"40896af2a661bccc60faf00b1726284c03ab94cf0ad2846c523390e6e437a592","candidate":{"description":"Controlled test of tolerance_ticks=0.5 against production defaults.","name":"grid-0036","parameters":{"tolerance_ticks":0.5},"source_sha256":"900c42c3f7bf18424beec561a9810bf93f06b0614cc8fea627143e06180d0c22"},"category":"wick-detection","commit":"df7720c78f91fa055f1e38e0e40ba32fa6eee8dc","effect":"trade-changed","generated_at_utc":"2026-09-04T21:49:46+00:00","incumbent_after":"production-baseline","incumbent_before":"production-baseline","objective":{"negative_overall_drawdown_r":-16.978904999999997,"overall_profit_factor":1.0531810718554657,"total_net_r":3.198862,"total_trades":91,"worst_fold_net_r":-4.268552},"outcome_sha256":"f28614612090952a108376d6d8b5baa2a8470051a32afc6d08a5a17e1a62c4be","previous_sha256":"89eb5bf6d45b763b360dcae45b4dd08b5596708f14a187efb79713fd16adcaf8","production_release_sha":"9ddd1b44aee10467247fda4627bc472ed1ff4132","record_sha256":"6fdb300b0e11d20251b413d237dcde16d6023aa4071c6f20b512b5fa46a65821","report_sha256":"857bd5d81fb4f2eb8a648812363967a3e058538cd759059c8a31c25ed9c65e08","run_id":"ba93346a390dcc61","schema_version":3,"score":"worst_fold_net_r=-4.268552;total_net_r=3.198862;overall_profit_factor=1.0531811;negative_overall_drawdown_r=-16.978905;total_trades=91","status":"discard","validation":{"dataset_directory":"dukascopy_m1_bidask_2025-05_2026-07","diagnostics":{"annualized_fold_sharpe":0.24012511733591504,"bootstrap":{"block_size":3,"confidence_level":0.9,"mean_fold_net_r_lower":-1.7566053333333334,"mean_fold_net_r_upper":2.0275888416666663,"method":"deterministic-circular-moving-block","probability_mean_positive":0.609,"samples":2000},"fold_count":12,"fold_net_r":[2.7699350000000003,-4.268552,-4.136999,-4.137785,-1.147626,2.836993,-3.1820319999999995,5.852645,3.752695,-1.017391,0.0,5.876979],"fold_net_r_stdev":3.8456281818633253,"largest_profitable_fold_share":0.27867182740094987,"mean_fold_net_r":0.26657183333333345,"median_fold_net_r":-0.5086955,"multiple_testing":{"bonferroni_adjusted_confidence":0.0,"prior_candidate_trials":40,"promotion_gate":false,"raw_probability_mean_positive":0.609,"selection_bias_risk":"high","trials_including_current":41},"nonnegative_fold_ratio":0.5,"one_sided_sign_test_p_value":0.80615234375,"profitable_fold_count":5,"profitable_fold_ratio":0.4166666666666667,"worst_rolling_three_fold_net_r":-12.543336},"neighbourhood_robustness":{"passed":false,"status":"not-run-base-gates-failed"},"profile":"phase1-walk-forward-v1","profile_sha256":"f02bfcf78d0fa2799c68ef4a7129ec5f635ce27ec3fe3a5267a7d0cfa3ed7afb"},"validation_profile_sha256":"f02bfcf78d0fa2799c68ef4a7129ec5f635ce27ec3fe3a5267a7d0cfa3ed7afb"}
