{"acceptance_gates":{"checks":{"april_2026_minimum_trades":true,"april_2026_positive_net_r":true,"august_2025_minimum_trades":true,"august_2025_positive_net_r":true,"december_2025_minimum_trades":true,"december_2025_positive_net_r":true,"february_2026_minimum_trades":true,"february_2026_positive_net_r":true,"january_2026_minimum_trades":true,"january_2026_positive_net_r":true,"july_2026_minimum_trades":false,"july_2026_positive_net_r":true,"june_2026_minimum_trades":false,"june_2026_positive_net_r":true,"march_2026_minimum_trades":true,"march_2026_positive_net_r":true,"maximum_ambiguous_exits":false,"maximum_overall_drawdown_r":false,"maximum_pair_trade_share":true,"maximum_single_fold_profit_share":false,"may_2026_minimum_trades":true,"may_2026_positive_net_r":true,"minimum_bootstrap_mean_fold_net_r_lower":false,"minimum_bootstrap_probability_mean_positive":false,"minimum_distinct_pairs":true,"minimum_overall_profit_factor":false,"minimum_profitable_fold_ratio":false,"minimum_total_trades":true,"minimum_worst_rolling_three_fold_net_r":false,"neighbourhood_robustness":false,"november_2025_minimum_trades":true,"november_2025_positive_net_r":true,"october_2025_minimum_trades":true,"october_2025_positive_net_r":true,"september_2025_minimum_trades":true,"september_2025_positive_net_r":true},"passed":false},"behavior_sha256":"0f52163a80a7be7d6914e6fe5d9ad48e8ad86619e5b697f93200bbbc51b7a0f6","candidate":{"description":"Controlled test of entry_model=origin_limit, expiry_bars=4, origin_zone_atr_fraction=0.12, origin_zone_minimum_ticks=2 against production defaults.","name":"grid-0708","parameters":{"entry_model":"origin_limit","expiry_bars":4,"origin_zone_atr_fraction":0.12,"origin_zone_minimum_ticks":2},"source_sha256":"c4193c02c6affbeaee2be66f22fa04750b882e5164adfe101924b39da573d567"},"category":"entry-model","commit":"df7720c78f91fa055f1e38e0e40ba32fa6eee8dc","effect":"trade-changed","generated_at_utc":"2026-09-04T21:50:26+00:00","incumbent_after":"production-baseline","incumbent_before":"production-baseline","objective":{"negative_overall_drawdown_r":-19.149068,"overall_profit_factor":0.75193694097431,"total_net_r":-12.418419,"total_trades":68,"worst_fold_net_r":-7.208073000000001},"outcome_sha256":"49431ad543a3871e15b9f7510d02661a37ab96b701d023d6fd0fddb068313261","previous_sha256":"6fdb300b0e11d20251b413d237dcde16d6023aa4071c6f20b512b5fa46a65821","production_release_sha":"9ddd1b44aee10467247fda4627bc472ed1ff4132","record_sha256":"b0786c8f621f57c4bbcfb72663b5ce5936cad0d0be865ec3869d686b720303d4","report_sha256":"69f30511b61e50d75b56fb84bd66873fbd061aea2f1f1f1db91aad611208c6bc","run_id":"111110a42e3c066d","schema_version":3,"score":"worst_fold_net_r=-7.208073;total_net_r=-12.418419;overall_profit_factor=0.75193694;negative_overall_drawdown_r=-19.149068;total_trades=68","status":"discard","validation":{"dataset_directory":"dukascopy_m1_bidask_2025-05_2026-07","diagnostics":{"annualized_fold_sharpe":-1.0934096902162536,"bootstrap":{"block_size":3,"confidence_level":0.9,"mean_fold_net_r_lower":-2.389949166666667,"mean_fold_net_r_upper":0.1323077499999999,"method":"deterministic-circular-moving-block","probability_mean_positive":0.0795,"samples":2000},"fold_count":12,"fold_net_r":[1.9147450000000001,-0.10954299999999972,-0.11939299999999986,-4.106146,-1.142368,3.7957209999999995,-6.1367069999999995,-1.128905,-7.208073000000001,1.978723,0.0,-0.15647300000000008],"fold_net_r_stdev":3.278632710462594,"largest_profitable_fold_share":0.49364386803341676,"mean_fold_net_r":-1.03486825,"median_fold_net_r":-0.13793299999999997,"multiple_testing":{"bonferroni_adjusted_confidence":0.0,"prior_candidate_trials":41,"promotion_gate":false,"raw_probability_mean_positive":0.0795,"selection_bias_risk":"high","trials_including_current":42},"nonnegative_fold_ratio":0.3333333333333333,"one_sided_sign_test_p_value":0.980712890625,"profitable_fold_count":3,"profitable_fold_ratio":0.25,"worst_rolling_three_fold_net_r":-14.473685},"neighbourhood_robustness":{"passed":false,"status":"not-run-base-gates-failed"},"profile":"phase1-walk-forward-v1","profile_sha256":"f02bfcf78d0fa2799c68ef4a7129ec5f635ce27ec3fe3a5267a7d0cfa3ed7afb"},"validation_profile_sha256":"f02bfcf78d0fa2799c68ef4a7129ec5f635ce27ec3fe3a5267a7d0cfa3ed7afb"}
{"acceptance_gates":{"checks":{"april_2026_minimum_trades":true,"april_2026_positive_net_r":true,"august_2025_minimum_trades":true,"august_2025_positive_net_r":true,"december_2025_minimum_trades":true,"december_2025_positive_net_r":true,"february_2026_minimum_trades":true,"february_2026_positive_net_r":true,"january_2026_minimum_trades":true,"january_2026_positive_net_r":true,"july_2026_minimum_trades":true,"july_2026_positive_net_r":true,"june_2026_minimum_trades":false,"june_2026_positive_net_r":true,"march_2026_minimum_trades":true,"march_2026_positive_net_r":true,"maximum_ambiguous_exits":false,"maximum_overall_drawdown_r":false,"maximum_pair_trade_share":true,"maximum_single_fold_profit_share":false,"may_2026_minimum_trades":true,"may_2026_positive_net_r":true,"minimum_bootstrap_mean_fold_net_r_lower":false,"minimum_bootstrap_probability_mean_positive":false,"minimum_distinct_pairs":true,"minimum_overall_profit_factor":false,"minimum_profitable_fold_ratio":false,"minimum_total_trades":true,"minimum_worst_rolling_three_fold_net_r":false,"neighbourhood_robustness":false,"november_2025_minimum_trades":true,"november_2025_positive_net_r":true,"october_2025_minimum_trades":true,"october_2025_positive_net_r":true,"september_2025_minimum_trades":true,"september_2025_positive_net_r":true},"passed":false},"behavior_sha256":"4386f02143a6b17ffb14d05cd65e0917db128a5e1024d7adcfa2f3d44473015c","candidate":{"description":"Controlled test of ema_slope_lookback=3 against production defaults.","name":"grid-0029","parameters":{"ema_slope_lookback":3},"source_sha256":"f2075067d4fb476c3195fe14732881b8734da4a88c2c86b9255b0c905e63471b"},"category":"trend-filter","commit":"df7720c78f91fa055f1e38e0e40ba32fa6eee8dc","effect":"trade-changed","generated_at_utc":"2026-09-04T21:51:07+00:00","incumbent_after":"production-baseline","incumbent_before":"production-baseline","objective":{"negative_overall_drawdown_r":-26.880931000000025,"overall_profit_factor":0.9009428116864957,"total_net_r":-11.528998,"total_trades":167,"worst_fold_net_r":-7.32537},"outcome_sha256":"d6d73abc4d7abda9d7b2b91238ec6ce46104755c9b1744e002726182672afcf3","previous_sha256":"b0786c8f621f57c4bbcfb72663b5ce5936cad0d0be865ec3869d686b720303d4","production_release_sha":"9ddd1b44aee10467247fda4627bc472ed1ff4132","record_sha256":"3b1673747615b53efa0d9357a6e2947374cb7b5f169d15451a20f3e59a2b5124","report_sha256":"61f1dc34c859c937aec8d24c01303963671c4c3ae3245123b4c64b99c91893fd","run_id":"a551c8e3c552620e","schema_version":3,"score":"worst_fold_net_r=-7.32537;total_net_r=-11.528998;overall_profit_factor=0.90094281;negative_overall_drawdown_r=-26.880931;total_trades=167","status":"discard","validation":{"dataset_directory":"dukascopy_m1_bidask_2025-05_2026-07","diagnostics":{"annualized_fold_sharpe":-0.6372657129821799,"bootstrap":{"block_size":3,"confidence_level":0.9,"mean_fold_net_r_lower":-3.3907358041666664,"mean_fold_net_r_upper":1.4015694958333331,"method":"deterministic-circular-moving-block","probability_mean_positive":0.2515,"samples":2000},"fold_count":12,"fold_net_r":[1.687424,-6.4398599999999995,-7.32537,-4.224317,-3.339746,0.7231429999999999,-4.248996,4.667039000000001,-0.3968910000000001,-1.0736949999999998,-3.086917,11.529188],"fold_net_r_stdev":5.222523323620886,"largest_profitable_fold_share":0.6196224884308387,"mean_fold_net_r":-0.9607498333333333,"median_fold_net_r":-2.080306,"multiple_testing":{"bonferroni_adjusted_confidence":0.0,"prior_candidate_trials":42,"promotion_gate":false,"raw_probability_mean_positive":0.2515,"selection_bias_risk":"high","trials_including_current":43},"nonnegative_fold_ratio":0.3333333333333333,"one_sided_sign_test_p_value":0.927001953125,"profitable_fold_count":4,"profitable_fold_ratio":0.3333333333333333,"worst_rolling_three_fold_net_r":-17.989547},"neighbourhood_robustness":{"passed":false,"status":"not-run-base-gates-failed"},"profile":"phase1-walk-forward-v1","profile_sha256":"f02bfcf78d0fa2799c68ef4a7129ec5f635ce27ec3fe3a5267a7d0cfa3ed7afb"},"validation_profile_sha256":"f02bfcf78d0fa2799c68ef4a7129ec5f635ce27ec3fe3a5267a7d0cfa3ed7afb"}
{"acceptance_gates":{"checks":{"april_2026_minimum_trades":true,"april_2026_positive_net_r":true,"august_2025_minimum_trades":true,"august_2025_positive_net_r":true,"december_2025_minimum_trades":true,"december_2025_positive_net_r":true,"february_2026_minimum_trades":true,"february_2026_positive_net_r":true,"january_2026_minimum_trades":true,"january_2026_positive_net_r":true,"july_2026_minimum_trades":true,"july_2026_positive_net_r":true,"june_2026_minimum_trades":false,"june_2026_positive_net_r":true,"march_2026_minimum_trades":true,"march_2026_positive_net_r":true,"maximum_ambiguous_exits":false,"maximum_overall_drawdown_r":false,"maximum_pair_trade_share":true,"maximum_single_fold_profit_share":false,"may_2026_minimum_trades":true,"may_2026_positive_net_r":true,"minimum_bootstrap_mean_fold_net_r_lower":false,"minimum_bootstrap_probability_mean_positive":false,"minimum_distinct_pairs":true,"minimum_overall_profit_factor":false,"minimum_profitable_fold_ratio":false,"minimum_total_trades":true,"minimum_worst_rolling_three_fold_net_r":false,"neighbourhood_robustness":false,"november_2025_minimum_trades":true,"november_2025_positive_net_r":true,"october_2025_minimum_trades":true,"october_2025_positive_net_r":true,"september_2025_minimum_trades":true,"september_2025_positive_net_r":true},"passed":false},"behavior_sha256":"74f0641ca081d9118b078bd51332257d4ef693ee25312a1f6349e799320439a4","candidate":{"description":"Controlled test of ema_length=45, maximum_wick_ticks=1.25 against production defaults.","name":"grid-0630","parameters":{"ema_length":45,"maximum_wick_ticks":1.25},"source_sha256":"0025000c30ef4eb1944c2b0e332a310609332c7d5e5379706ef1a26e9b10bcb5"},"category":"trend-filter+wick-detection","commit":"df7720c78f91fa055f1e38e0e40ba32fa6eee8dc","effect":"trade-changed","generated_at_utc":"2026-09-04T21:51:47+00:00","incumbent_after":"production-baseline","incumbent_before":"production-baseline","objective":{"negative_overall_drawdown_r":-25.193102000000003,"overall_profit_factor":0.9280300837780093,"total_net_r":-6.9044740000000004,"total_trades":139,"worst_fold_net_r":-6.308206},"outcome_sha256":"73f7d7cb07bd968336a7a38a0f75d2e00d509cb5dd5d90d1682fa0f6340d41e6","previous_sha256":"3b1673747615b53efa0d9357a6e2947374cb7b5f169d15451a20f3e59a2b5124","production_release_sha":"9ddd1b44aee10467247fda4627bc472ed1ff4132","record_sha256":"bb5f62a20978c522e5b9dd463d5719ae28c105f1004bddb41a0980c7bf33febe","report_sha256":"582de184f9bd515368ac28f42c235e9c5f546d18defb24ee7e85e0f23b1be0c3","run_id":"7e6e4830684a8cef","schema_version":3,"score":"worst_fold_net_r=-6.308206;total_net_r=-6.904474;overall_profit_factor=0.92803008;negative_overall_drawdown_r=-25.193102;total_trades=139","status":"discard","validation":{"dataset_directory":"dukascopy_m1_bidask_2025-05_2026-07","diagnostics":{"annualized_fold_sharpe":-0.42531065234908294,"bootstrap":{"block_size":3,"confidence_level":0.9,"mean_fold_net_r_lower":-3.0081603333333335,"mean_fold_net_r_upper":1.7412690000000002,"method":"deterministic-circular-moving-block","probability_mean_positive":0.3615,"samples":2000},"fold_count":12,"fold_net_r":[1.7517530000000001,-6.308206,-5.234381,-5.166151,-3.249461,0.7259959999999999,-2.2756629999999998,6.709293000000001,1.6403839999999998,-1.017391,-3.086917,8.60627],"fold_net_r_stdev":4.686339150566266,"largest_profitable_fold_share":0.44285297042827054,"mean_fold_net_r":-0.5753728333333333,"median_fold_net_r":-1.6465269999999999,"multiple_testing":{"bonferroni_adjusted_confidence":0.0,"prior_candidate_trials":43,"promotion_gate":false,"raw_probability_mean_positive":0.3615,"selection_bias_risk":"high","trials_including_current":44},"nonnegative_fold_ratio":0.4166666666666667,"one_sided_sign_test_p_value":0.80615234375,"profitable_fold_count":5,"profitable_fold_ratio":0.4166666666666667,"worst_rolling_three_fold_net_r":-16.708738},"neighbourhood_robustness":{"passed":false,"status":"not-run-base-gates-failed"},"profile":"phase1-walk-forward-v1","profile_sha256":"f02bfcf78d0fa2799c68ef4a7129ec5f635ce27ec3fe3a5267a7d0cfa3ed7afb"},"validation_profile_sha256":"f02bfcf78d0fa2799c68ef4a7129ec5f635ce27ec3fe3a5267a7d0cfa3ed7afb"}
{"acceptance_gates":{"checks":{"april_2026_minimum_trades":true,"april_2026_positive_net_r":true,"august_2025_minimum_trades":true,"august_2025_positive_net_r":true,"december_2025_minimum_trades":true,"december_2025_positive_net_r":true,"february_2026_minimum_trades":true,"february_2026_positive_net_r":true,"january_2026_minimum_trades":true,"january_2026_positive_net_r":true,"july_2026_minimum_trades":true,"july_2026_positive_net_r":true,"june_2026_minimum_trades":false,"june_2026_positive_net_r":true,"march_2026_minimum_trades":true,"march_2026_positive_net_r":true,"maximum_ambiguous_exits":false,"maximum_overall_drawdown_r":false,"maximum_pair_trade_share":true,"maximum_single_fold_profit_share":false,"may_2026_minimum_trades":true,"may_2026_positive_net_r":true,"minimum_bootstrap_mean_fold_net_r_lower":false,"minimum_bootstrap_probability_mean_positive":false,"minimum_distinct_pairs":true,"minimum_overall_profit_factor":false,"minimum_profitable_fold_ratio":false,"minimum_total_trades":true,"minimum_worst_rolling_three_fold_net_r":false,"neighbourhood_robustness":false,"november_2025_minimum_trades":true,"november_2025_positive_net_r":true,"october_2025_minimum_trades":true,"october_2025_positive_net_r":true,"september_2025_minimum_trades":true,"september_2025_positive_net_r":true},"passed":false},"behavior_sha256":"5eeca0f8bec7afb28a685b84f11f822e94c0b58175b434d90c6c287cf1c4c62f","candidate":{"description":"Controlled test of maximum_wick_ticks=1.5 against production defaults.","name":"grid-0038","parameters":{"maximum_wick_ticks":1.5},"source_sha256":"80b2b791bf57074894dca983793bc4a51840b60f1b3f1993d85f428f7ecd1961"},"category":"wick-detection","commit":"df7720c78f91fa055f1e38e0e40ba32fa6eee8dc","effect":"trade-changed","generated_at_utc":"2026-09-04T21:52:27+00:00","incumbent_after":"production-baseline","incumbent_before":"production-baseline","objective":{"negative_overall_drawdown_r":-28.413984000000003,"overall_profit_factor":0.8884840635119302,"total_net_r":-10.925624,"total_trades":140,"worst_fold_net_r":-6.308206},"outcome_sha256":"e15807b906589b0eb20bb05ab16b382c6bee63990a0f325bf2027752d0d5c951","previous_sha256":"bb5f62a20978c522e5b9dd463d5719ae28c105f1004bddb41a0980c7bf33febe","production_release_sha":"9ddd1b44aee10467247fda4627bc472ed1ff4132","record_sha256":"11c00a1c78f58713bbd49fda05e0cbabe5d25630edca9a478e7386b1ac0b7e22","report_sha256":"f98fc453db3c8378ac48a4bfa88e554a07e6363b6fd5cccb1ecab76734199200","run_id":"c84753b96b687508","schema_version":3,"score":"worst_fold_net_r=-6.308206;total_net_r=-10.925624;overall_profit_factor=0.88848406;negative_overall_drawdown_r=-28.413984;total_trades=140","status":"discard","validation":{"dataset_directory":"dukascopy_m1_bidask_2025-05_2026-07","diagnostics":{"annualized_fold_sharpe":-0.6488167394021302,"bootstrap":{"block_size":3,"confidence_level":0.9,"mean_fold_net_r_lower":-3.385896266666667,"mean_fold_net_r_upper":1.4782173958333331,"method":"deterministic-circular-moving-block","probability_mean_positive":0.289,"samples":2000},"fold_count":12,"fold_net_r":[1.7517530000000001,-6.308206,-6.253249,-6.185382000000001,-3.249461,-1.257055,-2.2756629999999998,6.709293000000001,1.6403839999999998,-1.017391,-3.086917,8.60627],"fold_net_r_stdev":4.861089098346347,"largest_profitable_fold_share":0.46003891445768313,"mean_fold_net_r":-0.9104686666666667,"median_fold_net_r":-1.766359,"multiple_testing":{"bonferroni_adjusted_confidence":0.0,"prior_candidate_trials":44,"promotion_gate":false,"raw_probability_mean_positive":0.289,"selection_bias_risk":"high","trials_including_current":45},"nonnegative_fold_ratio":0.3333333333333333,"one_sided_sign_test_p_value":0.927001953125,"profitable_fold_count":4,"profitable_fold_ratio":0.3333333333333333,"worst_rolling_three_fold_net_r":-18.746837},"neighbourhood_robustness":{"passed":false,"status":"not-run-base-gates-failed"},"profile":"phase1-walk-forward-v1","profile_sha256":"f02bfcf78d0fa2799c68ef4a7129ec5f635ce27ec3fe3a5267a7d0cfa3ed7afb"},"validation_profile_sha256":"f02bfcf78d0fa2799c68ef4a7129ec5f635ce27ec3fe3a5267a7d0cfa3ed7afb"}
{"acceptance_gates":{"checks":{"april_2026_minimum_trades":true,"april_2026_positive_net_r":true,"august_2025_minimum_trades":true,"august_2025_positive_net_r":true,"december_2025_minimum_trades":true,"december_2025_positive_net_r":true,"february_2026_minimum_trades":true,"february_2026_positive_net_r":true,"january_2026_minimum_trades":true,"january_2026_positive_net_r":true,"july_2026_minimum_trades":false,"july_2026_positive_net_r":true,"june_2026_minimum_trades":false,"june_2026_positive_net_r":true,"march_2026_minimum_trades":true,"march_2026_positive_net_r":true,"maximum_ambiguous_exits":false,"maximum_overall_drawdown_r":false,"maximum_pair_trade_share":true,"maximum_single_fold_profit_share":false,"may_2026_minimum_trades":true,"may_2026_positive_net_r":true,"minimum_bootstrap_mean_fold_net_r_lower":false,"minimum_bootstrap_probability_mean_positive":false,"minimum_distinct_pairs":true,"minimum_overall_profit_factor":false,"minimum_profitable_fold_ratio":false,"minimum_total_trades":false,"minimum_worst_rolling_three_fold_net_r":false,"neighbourhood_robustness":false,"november_2025_minimum_trades":true,"november_2025_positive_net_r":true,"october_2025_minimum_trades":true,"october_2025_positive_net_r":true,"september_2025_minimum_trades":true,"september_2025_positive_net_r":true},"passed":false},"behavior_sha256":"a4d376e48aca2df5f6f8011a7eefb4a1f36cea1b4dab56adeca85284600c9033","candidate":{"description":"Controlled test of entry_model=origin_limit, expiry_bars=3, origin_zone_atr_fraction=0.1, origin_zone_minimum_ticks=3, invalidate_on_trend_change=False against production defaults.","name":"grid-0710","parameters":{"entry_model":"origin_limit","expiry_bars":3,"invalidate_on_trend_change":false,"origin_zone_atr_fraction":0.1,"origin_zone_minimum_ticks":3},"source_sha256":"9d287d9a904fd09a1311cef1eaef7395805b3b7806b82452fe282bb5d0eb7a74"},"category":"entry-model","commit":"df7720c78f91fa055f1e38e0e40ba32fa6eee8dc","effect":"trade-changed","generated_at_utc":"2026-09-04T21:53:08+00:00","incumbent_after":"production-baseline","incumbent_before":"production-baseline","objective":{"negative_overall_drawdown_r":-15.027971,"overall_profit_factor":0.8041510012778206,"total_net_r":-8.203669,"total_trades":58,"worst_fold_net_r":-6.1367069999999995},"outcome_sha256":"4d78e702c4f1975038a2932beebaa6207e1c7fcfbf2dd4a3277dd2969221aad6","previous_sha256":"11c00a1c78f58713bbd49fda05e0cbabe5d25630edca9a478e7386b1ac0b7e22","production_release_sha":"9ddd1b44aee10467247fda4627bc472ed1ff4132","record_sha256":"aad50fc462ce41b4533996ae02eb8869489ac8824fcf2eb9358266a87484c88a","report_sha256":"e0c51545912eecf4fe6abd6a0dbf19798fa651768ce20b8cc4a806f04037431e","run_id":"4ff03a1f3ba88b58","schema_version":3,"score":"worst_fold_net_r=-6.136707;total_net_r=-8.203669;overall_profit_factor=0.804151;negative_overall_drawdown_r=-15.027971;total_trades=58","status":"discard","validation":{"dataset_directory":"dukascopy_m1_bidask_2025-05_2026-07","diagnostics":{"annualized_fold_sharpe":-0.9387615720633216,"bootstrap":{"block_size":3,"confidence_level":0.9,"mean_fold_net_r_lower":-1.629608595833335,"mean_fold_net_r_upper":0.13840183333333334,"method":"deterministic-circular-moving-block","probability_mean_positive":0.096,"samples":2000},"fold_count":12,"fold_net_r":[1.9147450000000001,-1.069543,-1.1379119999999998,-1.1113369999999998,-1.142368,2.8392799999999996,-6.1367069999999995,-0.11482000000000014,-4.16091,1.978723,0.0,-0.0628200000000001],"fold_net_r_stdev":2.522680223841282,"largest_profitable_fold_share":0.4217119072331238,"mean_fold_net_r":-0.6836390833333333,"median_fold_net_r":-0.5921815,"multiple_testing":{"bonferroni_adjusted_confidence":0.0,"prior_candidate_trials":45,"promotion_gate":false,"raw_probability_mean_positive":0.096,"selection_bias_risk":"high","trials_including_current":46},"nonnegative_fold_ratio":0.3333333333333333,"one_sided_sign_test_p_value":0.980712890625,"profitable_fold_count":3,"profitable_fold_ratio":0.25,"worst_rolling_three_fold_net_r":-10.412437},"neighbourhood_robustness":{"passed":false,"status":"not-run-base-gates-failed"},"profile":"phase1-walk-forward-v1","profile_sha256":"f02bfcf78d0fa2799c68ef4a7129ec5f635ce27ec3fe3a5267a7d0cfa3ed7afb"},"validation_profile_sha256":"f02bfcf78d0fa2799c68ef4a7129ec5f635ce27ec3fe3a5267a7d0cfa3ed7afb"}
