{"acceptance_gates":{"checks":{"july_2026_minimum_trades":true,"july_2026_positive_net_r":true,"june_2026_minimum_trades":false,"june_2026_positive_net_r":true,"maximum_ambiguous_exits":true,"maximum_overall_drawdown_r":false,"maximum_pair_trade_share":true,"minimum_distinct_pairs":true,"minimum_overall_profit_factor":true,"minimum_total_trades":true},"passed":false},"behavior_sha256":"ae814932e58a8c2123003436bc950e14a3068185f1cc2737259f49b975e944e4","candidate":{"description":"Controlled test of minimum_body_ratio=0.86 against production defaults.","name":"grid-0005","parameters":{"minimum_body_ratio":0.86},"source_sha256":"473c991afc91a0ca37f0e90f0a289a1d204660d3f81027946dde7ddfe417a82c"},"category":"candle-quality","commit":"a9043da6df00eb956d1c519a337904c8a55351b1","effect":"funnel-only","generated_at_utc":"2026-08-05T13:30:40+00:00","incumbent_after":"production-baseline","incumbent_before":"production-baseline","objective":{"negative_overall_drawdown_r":-5.222238,"overall_profit_factor":1.7292928119866589,"total_net_r":7.498075999999999,"total_trades":19,"worst_fold_net_r":-3.086917},"outcome_sha256":"432f57860ab9960cccdcd8fc248f58a2e221a653ea1b93da36727356f0d5ec5a","previous_sha256":"70e0f3f60d558dab7df7d3dc918d3162039b78934809706ee3b8f3f0d73127e7","production_release_sha":"9ddd1b44aee10467247fda4627bc472ed1ff4132","record_sha256":"0cd3ae10169b6d3e1a01f4975be9d2008bc4d72faac04a96fc154e14edf3cad6","report_sha256":"930d63c9976f0c2cd21784069019e39fd26a940b79a67ff0e96662e71e0af643","run_id":"fc645bc86fcb64cc","schema_version":2,"score":"worst_fold_net_r=-3.086917;total_net_r=7.498076;overall_profit_factor=1.7292928;negative_overall_drawdown_r=-5.222238;total_trades=19","status":"discard"}
{"acceptance_gates":{"checks":{"july_2026_minimum_trades":true,"july_2026_positive_net_r":true,"june_2026_minimum_trades":false,"june_2026_positive_net_r":true,"maximum_ambiguous_exits":true,"maximum_overall_drawdown_r":false,"maximum_pair_trade_share":true,"minimum_distinct_pairs":true,"minimum_overall_profit_factor":true,"minimum_total_trades":true},"passed":false},"behavior_sha256":"9cd33382c2f9068202db013e42037caf104781510ae28afc4e80a341e96fd6f1","candidate":{"description":"Controlled test of minimum_body_ratio=0.82, ema_length=45 against production defaults.","name":"grid-0124","parameters":{"ema_length":45,"minimum_body_ratio":0.82},"source_sha256":"18ae575e4d40286c2555cdf7329263b9a765708ecc05a34963d3ce0a16693c70"},"category":"candle-quality+trend-filter","commit":"f7500d1d5854db4a57b860dcd8a1f9673d907f9a","effect":"funnel-only","generated_at_utc":"2026-08-05T13:30:45+00:00","incumbent_after":"production-baseline","incumbent_before":"production-baseline","objective":{"negative_overall_drawdown_r":-5.222238,"overall_profit_factor":1.7292928119866589,"total_net_r":7.498075999999999,"total_trades":19,"worst_fold_net_r":-3.086917},"outcome_sha256":"432f57860ab9960cccdcd8fc248f58a2e221a653ea1b93da36727356f0d5ec5a","previous_sha256":"0cd3ae10169b6d3e1a01f4975be9d2008bc4d72faac04a96fc154e14edf3cad6","production_release_sha":"9ddd1b44aee10467247fda4627bc472ed1ff4132","record_sha256":"603b3143ea6350fc3a142fdf82c1fa3b173ea07d2cf82adda56df7c6ac1543a1","report_sha256":"cc2ed4c26d60d19b41ce33306f81d7608f02fdb08d17865a985252170414294d","run_id":"39f4165667aff273","schema_version":2,"score":"worst_fold_net_r=-3.086917;total_net_r=7.498076;overall_profit_factor=1.7292928;negative_overall_drawdown_r=-5.222238;total_trades=19","status":"discard"}
{"acceptance_gates":{"checks":{"july_2026_minimum_trades":true,"july_2026_positive_net_r":true,"june_2026_minimum_trades":false,"june_2026_positive_net_r":true,"maximum_ambiguous_exits":true,"maximum_overall_drawdown_r":false,"maximum_pair_trade_share":true,"minimum_distinct_pairs":true,"minimum_overall_profit_factor":true,"minimum_total_trades":true},"passed":false},"behavior_sha256":"e44bb12bd64160dbc13642eb22dc155398c88591859df1b8d588fd285ac7c683","candidate":{"description":"Controlled test of minimum_body_ratio=0.82, tolerance_ticks=1.5 against production defaults.","name":"grid-0202","parameters":{"minimum_body_ratio":0.82,"tolerance_ticks":1.5},"source_sha256":"836d220f407a48e1d56dee7c76debdae726f19769114d44f6976021555e52397"},"category":"candle-quality+wick-detection","commit":"f7ba9947b86a17fab016ae04fb1e86ceefea8d9f","effect":"trade-changed","generated_at_utc":"2026-08-05T13:30:50+00:00","incumbent_after":"production-baseline","incumbent_before":"production-baseline","objective":{"negative_overall_drawdown_r":-5.222238,"overall_profit_factor":1.5368343118577354,"total_net_r":5.519353,"total_trades":18,"worst_fold_net_r":-3.086917},"outcome_sha256":"45c9470ee2a1914c3a7fa278a57e66a3c3b68160afb9ee15cd75897a8f4ddc65","previous_sha256":"603b3143ea6350fc3a142fdf82c1fa3b173ea07d2cf82adda56df7c6ac1543a1","production_release_sha":"9ddd1b44aee10467247fda4627bc472ed1ff4132","record_sha256":"00131f0e2d7c8a325c69d7d43b3357634313595d04b3ab340ea4d5fd1fa8be5d","report_sha256":"0c6944e7c1a3bb4cf88374f27dfb188fd29e36134324346faf07cbfc01088d2d","run_id":"9c2eac24ff4c3798","schema_version":2,"score":"worst_fold_net_r=-3.086917;total_net_r=5.519353;overall_profit_factor=1.5368343;negative_overall_drawdown_r=-5.222238;total_trades=18","status":"discard"}
{"acceptance_gates":{"checks":{"july_2026_minimum_trades":true,"july_2026_positive_net_r":true,"june_2026_minimum_trades":false,"june_2026_positive_net_r":true,"maximum_ambiguous_exits":true,"maximum_overall_drawdown_r":false,"maximum_pair_trade_share":true,"minimum_distinct_pairs":true,"minimum_overall_profit_factor":true,"minimum_total_trades":true},"passed":false},"behavior_sha256":"9cd33382c2f9068202db013e42037caf104781510ae28afc4e80a341e96fd6f1","candidate":{"description":"Controlled test of ema_length=45 against production defaults.","name":"grid-0021","parameters":{"ema_length":45},"source_sha256":"5c2fc4625513c0bd88def36059ad84e372ff5ce8eef40e1bd313a8c3bcefd448"},"category":"trend-filter","commit":"4e513864548e3d7da04024eb2b1b468bf93be17f","effect":"funnel-only","generated_at_utc":"2026-08-05T13:30:55+00:00","incumbent_after":"production-baseline","incumbent_before":"production-baseline","objective":{"negative_overall_drawdown_r":-5.222238,"overall_profit_factor":1.7292928119866589,"total_net_r":7.498075999999999,"total_trades":19,"worst_fold_net_r":-3.086917},"outcome_sha256":"432f57860ab9960cccdcd8fc248f58a2e221a653ea1b93da36727356f0d5ec5a","previous_sha256":"00131f0e2d7c8a325c69d7d43b3357634313595d04b3ab340ea4d5fd1fa8be5d","production_release_sha":"9ddd1b44aee10467247fda4627bc472ed1ff4132","record_sha256":"fc90a8c110a55e543a7415ae82c8cd1f5404e24f292e52572c6a4dc56f284913","report_sha256":"57c28ddb093f3188d35d7fb787596dbb26c5601d93f9c73592e2eb063517a6f3","run_id":"c457ba420f268ffe","schema_version":2,"score":"worst_fold_net_r=-3.086917;total_net_r=7.498076;overall_profit_factor=1.7292928;negative_overall_drawdown_r=-5.222238;total_trades=19","status":"discard"}
{"acceptance_gates":{"checks":{"july_2026_minimum_trades":true,"july_2026_positive_net_r":true,"june_2026_minimum_trades":false,"june_2026_positive_net_r":true,"maximum_ambiguous_exits":true,"maximum_overall_drawdown_r":false,"maximum_pair_trade_share":true,"minimum_distinct_pairs":true,"minimum_overall_profit_factor":true,"minimum_total_trades":true},"passed":false},"behavior_sha256":"2bcec4415a803608646a31c5bd0f69d9b3e217646e9972007bed37670ae48435","candidate":{"description":"Controlled test of ema_length=45, tolerance_ticks=1.5 against production defaults.","name":"grid-0610","parameters":{"ema_length":45,"tolerance_ticks":1.5},"source_sha256":"5f58b9b7224c5f9330c42660ded6a4353ba8d6ea6aa904520e5b554c026549c4"},"category":"trend-filter+wick-detection","commit":"3f6c2a0d0202870f81731f6d3814df94219cafe6","effect":"trade-changed","generated_at_utc":"2026-08-05T13:31:01+00:00","incumbent_after":"production-baseline","incumbent_before":"production-baseline","objective":{"negative_overall_drawdown_r":-5.222238,"overall_profit_factor":1.5368343118577354,"total_net_r":5.519353,"total_trades":18,"worst_fold_net_r":-3.086917},"outcome_sha256":"45c9470ee2a1914c3a7fa278a57e66a3c3b68160afb9ee15cd75897a8f4ddc65","previous_sha256":"fc90a8c110a55e543a7415ae82c8cd1f5404e24f292e52572c6a4dc56f284913","production_release_sha":"9ddd1b44aee10467247fda4627bc472ed1ff4132","record_sha256":"00e555373d6c350cc8e62fddeced4c95f9e70e671f8f5722291e9dad18566de9","report_sha256":"37497c2a74e9a113a26894adff0eec28165e9cdb20a46e649dde110841d5a814","run_id":"f9170d96b11a64f5","schema_version":2,"score":"worst_fold_net_r=-3.086917;total_net_r=5.519353;overall_profit_factor=1.5368343;negative_overall_drawdown_r=-5.222238;total_trades=18","status":"discard"}
{"acceptance_gates":{"checks":{"july_2026_minimum_trades":false,"july_2026_positive_net_r":true,"june_2026_minimum_trades":false,"june_2026_positive_net_r":true,"maximum_ambiguous_exits":true,"maximum_overall_drawdown_r":true,"maximum_pair_trade_share":false,"minimum_distinct_pairs":false,"minimum_overall_profit_factor":true,"minimum_total_trades":false},"passed":false},"behavior_sha256":"5a9847cd3b98e0064acb79e0d0df2d6db2b29188f10b5a53f1b9fcbe7caf5a00","candidate":{"description":"Controlled test of entry_model=zone_reclaim, expiry_bars=2, origin_zone_atr_fraction=0.08, reclaim_buffer_ticks=0, maximum_entry_displacement_atr=0.2 against production defaults.","name":"grid-0703","parameters":{"entry_model":"zone_reclaim","expiry_bars":2,"maximum_entry_displacement_atr":0.2,"origin_zone_atr_fraction":0.08,"reclaim_buffer_ticks":0},"source_sha256":"7a4b7a47bf1101025dac143495d3cc4e054051d76dc7cca104b7986d842dcf33"},"category":"entry-model","commit":"37228717a8be647f871a443b6a9f140abd6f53ce","effect":"trade-changed","generated_at_utc":"2026-08-05T13:31:06+00:00","incumbent_after":"production-baseline","incumbent_before":"production-baseline","objective":{"negative_overall_drawdown_r":-0.0,"overall_profit_factor":1000000000000.0,"total_net_r":0,"total_trades":0,"worst_fold_net_r":0},"outcome_sha256":"508467b3eea448871adab44c6aa6b8b1362f7d32e89b3ba759e228c68758573a","previous_sha256":"00e555373d6c350cc8e62fddeced4c95f9e70e671f8f5722291e9dad18566de9","production_release_sha":"9ddd1b44aee10467247fda4627bc472ed1ff4132","record_sha256":"e560e1b93cb78b691cc721e526c9e8e1cc1602274608f142b5d5f5597b0c0719","report_sha256":"3f5c035e54d7ddaed2c94c76993cbf2f3a622e5fcc9354d7c6cde56e11eb095b","run_id":"612202542924aa9e","schema_version":2,"score":"worst_fold_net_r=0;total_net_r=0;overall_profit_factor=1e+12;negative_overall_drawdown_r=-0;total_trades=0","status":"discard"}
{"acceptance_gates":{"checks":{"july_2026_minimum_trades":true,"july_2026_positive_net_r":true,"june_2026_minimum_trades":false,"june_2026_positive_net_r":true,"maximum_ambiguous_exits":true,"maximum_overall_drawdown_r":false,"maximum_pair_trade_share":true,"minimum_distinct_pairs":true,"minimum_overall_profit_factor":true,"minimum_total_trades":true},"passed":false},"behavior_sha256":"e44bb12bd64160dbc13642eb22dc155398c88591859df1b8d588fd285ac7c683","candidate":{"description":"Controlled test of tolerance_ticks=1.5 against production defaults.","name":"grid-0034","parameters":{"tolerance_ticks":1.5},"source_sha256":"9f8e0856f287d0ff228a6c51bddb0916b89abec51744b23fa464411e51220918"},"category":"wick-detection","commit":"48dfdb5a42803190b6639a05db3d081c04498c6a","effect":"trade-changed","generated_at_utc":"2026-08-05T13:31:11+00:00","incumbent_after":"production-baseline","incumbent_before":"production-baseline","objective":{"negative_overall_drawdown_r":-5.222238,"overall_profit_factor":1.5368343118577354,"total_net_r":5.519353,"total_trades":18,"worst_fold_net_r":-3.086917},"outcome_sha256":"45c9470ee2a1914c3a7fa278a57e66a3c3b68160afb9ee15cd75897a8f4ddc65","previous_sha256":"e560e1b93cb78b691cc721e526c9e8e1cc1602274608f142b5d5f5597b0c0719","production_release_sha":"9ddd1b44aee10467247fda4627bc472ed1ff4132","record_sha256":"822a723ae2e69830b1a8dc723b69ff64da3690b84348e80d264d3734b02cacdc","report_sha256":"71aef66a702f67a22c5eb5f9806c0e63b99d5dbef67eb19a9846404357ec37b5","run_id":"428ffb367ea2e6e0","schema_version":2,"score":"worst_fold_net_r=-3.086917;total_net_r=5.519353;overall_profit_factor=1.5368343;negative_overall_drawdown_r=-5.222238;total_trades=18","status":"discard"}
{"acceptance_gates":{"checks":{"july_2026_minimum_trades":true,"july_2026_positive_net_r":true,"june_2026_minimum_trades":false,"june_2026_positive_net_r":true,"maximum_ambiguous_exits":true,"maximum_overall_drawdown_r":false,"maximum_pair_trade_share":true,"minimum_distinct_pairs":true,"minimum_overall_profit_factor":true,"minimum_total_trades":true},"passed":false},"behavior_sha256":"c540146704cf9c875f6233fb464de6ec6cde21d6a1ab206155580b47de57f575","candidate":{"description":"Controlled test of minimum_range_atr=0.6 against production defaults.","name":"grid-0011","parameters":{"minimum_range_atr":0.6},"source_sha256":"5ce241a858b886058767f8f79e083bc040527412db4355d752df9e7a6042f257"},"category":"candle-quality","commit":"b20ac3eda8543b40a91fedb6355ea60bdc51fe7b","effect":"funnel-only","generated_at_utc":"2026-08-05T13:31:16+00:00","incumbent_after":"production-baseline","incumbent_before":"production-baseline","objective":{"negative_overall_drawdown_r":-5.222238,"overall_profit_factor":1.7292928119866589,"total_net_r":7.498075999999999,"total_trades":19,"worst_fold_net_r":-3.086917},"outcome_sha256":"432f57860ab9960cccdcd8fc248f58a2e221a653ea1b93da36727356f0d5ec5a","previous_sha256":"822a723ae2e69830b1a8dc723b69ff64da3690b84348e80d264d3734b02cacdc","production_release_sha":"9ddd1b44aee10467247fda4627bc472ed1ff4132","record_sha256":"a8ccfd0576d3dc6d3b6fc6ca1fc4024fb4fc9c895b3aaba223f3f860ee2de5ed","report_sha256":"714e2d79d4ffc3a89a1d883e13ba0f5b065de9b26f952d0162dbd48dee1aa9aa","run_id":"f1098a05ef511ce8","schema_version":2,"score":"worst_fold_net_r=-3.086917;total_net_r=7.498076;overall_profit_factor=1.7292928;negative_overall_drawdown_r=-5.222238;total_trades=19","status":"discard"}
{"acceptance_gates":{"checks":{"july_2026_minimum_trades":true,"july_2026_positive_net_r":true,"june_2026_minimum_trades":false,"june_2026_positive_net_r":true,"maximum_ambiguous_exits":true,"maximum_overall_drawdown_r":false,"maximum_pair_trade_share":true,"minimum_distinct_pairs":true,"minimum_overall_profit_factor":true,"minimum_total_trades":true},"passed":false},"behavior_sha256":"3f68a48e9a3aa34513b08093935aafe67f2cd79ee009b1fae97de32139b6d1cb","candidate":{"description":"Controlled test of minimum_body_ratio=0.82, ema_slope_lookback=4 against production defaults.","name":"grid-0160","parameters":{"ema_slope_lookback":4,"minimum_body_ratio":0.82},"source_sha256":"66f87e3b5a95477b12b7d7db0342ca273201e9e2a1b8fdf5ffbef507484561a6"},"category":"candle-quality+trend-filter","commit":"b2d602878c2d5e44e59986693f57e1ae8720d03b","effect":"funnel-only","generated_at_utc":"2026-08-05T13:31:21+00:00","incumbent_after":"production-baseline","incumbent_before":"production-baseline","objective":{"negative_overall_drawdown_r":-5.222238,"overall_profit_factor":1.7292928119866589,"total_net_r":7.498075999999999,"total_trades":19,"worst_fold_net_r":-3.086917},"outcome_sha256":"432f57860ab9960cccdcd8fc248f58a2e221a653ea1b93da36727356f0d5ec5a","previous_sha256":"a8ccfd0576d3dc6d3b6fc6ca1fc4024fb4fc9c895b3aaba223f3f860ee2de5ed","production_release_sha":"9ddd1b44aee10467247fda4627bc472ed1ff4132","record_sha256":"6f663b90f98a02f5bad4f44c4a3930260939ca3c7b6ab6d8c1df4c0c62bb7806","report_sha256":"a41757f81f0be6ca6e82fe1f17a0e72b578c518487f438658230e4f02754a138","run_id":"e8778938eff2bf5d","schema_version":2,"score":"worst_fold_net_r=-3.086917;total_net_r=7.498076;overall_profit_factor=1.7292928;negative_overall_drawdown_r=-5.222238;total_trades=19","status":"discard"}
{"acceptance_gates":{"checks":{"july_2026_minimum_trades":true,"july_2026_positive_net_r":true,"june_2026_minimum_trades":false,"june_2026_positive_net_r":true,"maximum_ambiguous_exits":true,"maximum_overall_drawdown_r":false,"maximum_pair_trade_share":true,"minimum_distinct_pairs":true,"minimum_overall_profit_factor":true,"minimum_total_trades":true},"passed":false},"behavior_sha256":"f72840faca689e77ae60587318282b91af48f1f990b786c5644f49d304de97c8","candidate":{"description":"Controlled test of minimum_body_ratio=0.82, maximum_wick_ticks=1.75 against production defaults.","name":"grid-0220","parameters":{"maximum_wick_ticks":1.75,"minimum_body_ratio":0.82},"source_sha256":"6e656fea62dc92127f4d28e1d3ecf0d628233237b274c4fbe15ad30ce2960dfd"},"category":"candle-quality+wick-detection","commit":"3ac83f2883e2092c01af69fafde2b7e94e0f95ac","effect":"trade-changed","generated_at_utc":"2026-08-05T13:31:26+00:00","incumbent_after":"production-baseline","incumbent_before":"production-baseline","objective":{"negative_overall_drawdown_r":-5.222238,"overall_profit_factor":1.5368343118577354,"total_net_r":5.519353,"total_trades":18,"worst_fold_net_r":-3.086917},"outcome_sha256":"45c9470ee2a1914c3a7fa278a57e66a3c3b68160afb9ee15cd75897a8f4ddc65","previous_sha256":"6f663b90f98a02f5bad4f44c4a3930260939ca3c7b6ab6d8c1df4c0c62bb7806","production_release_sha":"9ddd1b44aee10467247fda4627bc472ed1ff4132","record_sha256":"f26891e65d84044deb0f59315a6c7d9b4209a16c7a276240dcf581b7e052e193","report_sha256":"da22831e1164cbbf4e72211708953d27b6c59c714f45eea8ad30013b370c68a9","run_id":"d3dde6274bc11616","schema_version":2,"score":"worst_fold_net_r=-3.086917;total_net_r=5.519353;overall_profit_factor=1.5368343;negative_overall_drawdown_r=-5.222238;total_trades=18","status":"discard"}
{"acceptance_gates":{"checks":{"july_2026_minimum_trades":true,"july_2026_positive_net_r":true,"june_2026_minimum_trades":false,"june_2026_positive_net_r":true,"maximum_ambiguous_exits":true,"maximum_overall_drawdown_r":false,"maximum_pair_trade_share":true,"minimum_distinct_pairs":true,"minimum_overall_profit_factor":true,"minimum_total_trades":true},"passed":false},"behavior_sha256":"3f68a48e9a3aa34513b08093935aafe67f2cd79ee009b1fae97de32139b6d1cb","candidate":{"description":"Controlled test of ema_slope_lookback=4 against production defaults.","name":"grid-0027","parameters":{"ema_slope_lookback":4},"source_sha256":"f44807f8066099e2dedfcb2ffcd436ea1eb52fbc12301d418edde032c436326d"},"category":"trend-filter","commit":"dd735ccc3de7c650c333e80d798cf955f1a9d4d8","effect":"funnel-only","generated_at_utc":"2026-08-05T13:31:31+00:00","incumbent_after":"production-baseline","incumbent_before":"production-baseline","objective":{"negative_overall_drawdown_r":-5.222238,"overall_profit_factor":1.7292928119866589,"total_net_r":7.498075999999999,"total_trades":19,"worst_fold_net_r":-3.086917},"outcome_sha256":"432f57860ab9960cccdcd8fc248f58a2e221a653ea1b93da36727356f0d5ec5a","previous_sha256":"f26891e65d84044deb0f59315a6c7d9b4209a16c7a276240dcf581b7e052e193","production_release_sha":"9ddd1b44aee10467247fda4627bc472ed1ff4132","record_sha256":"b4eaefa7b95273aebf07da52476cbbd54d772396c692066ab98bfe9533616d2d","report_sha256":"1e6837129dc969ab18f392253758b35f5016da6e95a506e212397070da484c80","run_id":"2e2fe7f9b73e4649","schema_version":2,"score":"worst_fold_net_r=-3.086917;total_net_r=7.498076;overall_profit_factor=1.7292928;negative_overall_drawdown_r=-5.222238;total_trades=19","status":"discard"}
{"acceptance_gates":{"checks":{"july_2026_minimum_trades":true,"july_2026_positive_net_r":true,"june_2026_minimum_trades":false,"june_2026_positive_net_r":true,"maximum_ambiguous_exits":true,"maximum_overall_drawdown_r":false,"maximum_pair_trade_share":true,"minimum_distinct_pairs":true,"minimum_overall_profit_factor":true,"minimum_total_trades":true},"passed":false},"behavior_sha256":"b4cf2ca2f3a55a7de50f3b90b0ddc9d6ba1e1d82f2f7ee7a4799575c1cd84089","candidate":{"description":"Controlled test of ema_length=45, maximum_wick_ticks=1.75 against production defaults.","name":"grid-0628","parameters":{"ema_length":45,"maximum_wick_ticks":1.75},"source_sha256":"8c9d04c4cdf6e66f2ff6948bd984a8fd98006f33de3fac58fb5dbde4d5b9b3b5"},"category":"trend-filter+wick-detection","commit":"c740de5c22ae9d19664e35b9ae7437dc14ba2dd6","effect":"trade-changed","generated_at_utc":"2026-08-05T13:31:36+00:00","incumbent_after":"production-baseline","incumbent_before":"production-baseline","objective":{"negative_overall_drawdown_r":-5.222238,"overall_profit_factor":1.5368343118577354,"total_net_r":5.519353,"total_trades":18,"worst_fold_net_r":-3.086917},"outcome_sha256":"45c9470ee2a1914c3a7fa278a57e66a3c3b68160afb9ee15cd75897a8f4ddc65","previous_sha256":"b4eaefa7b95273aebf07da52476cbbd54d772396c692066ab98bfe9533616d2d","production_release_sha":"9ddd1b44aee10467247fda4627bc472ed1ff4132","record_sha256":"f5a004d85c12a3cece80763640a0bf26ee36576c2098f008ce74ae991c937749","report_sha256":"0f1e7a555407547e0e26264ce39d6d12d26213edf434d2778ebcdf9db3f737a1","run_id":"9d08a6eb2e77b2aa","schema_version":2,"score":"worst_fold_net_r=-3.086917;total_net_r=5.519353;overall_profit_factor=1.5368343;negative_overall_drawdown_r=-5.222238;total_trades=18","status":"discard"}
